bleu,x,y,z
0.052503071099425286,"the us national intelligence estimate in february named france alongside russia and israel in a second tier of offenders who engage in hacking for economic intelligence , behind china , according to the washington post .","हमारे राष्ट्रीय ज्ञान का अनुमान है कि जिहाद के विरोधियों के दूसरे स्तर पर निराशा और निर्वीधता का अनुमान है , जो चीन के पीछे अपनी आर्थिक प्रतिभा के लिए बदनाम है , जो भारत के पीछे है ।","फ्रांस द वाशिंगटन पोस्ट के अनुसार फ़रवरी में अमेरिकी राष्ट्रीय खुफिया का नाम रूस और इसराइल के साथ चीन के पीछे जो आर्थिक आसूचना , लिए हैकिंग में संलग्न अपराधियों के एक दूसरे टीयर में नामित ।"
0.013670175654149607,"a board member at a german blue - chip company concurred that when it comes to economic espionage , "" the french are the worst . """,एक बोर्ड सदस्य . . . . . . . ।,"एक जर्मन ब्लू चिप कंपनी के बोर्ड सदस्यके अनुसार जब बात आर्थिक जासूसी करने के लिए आती है , तो "" फ्रेंच सबसे खराब"
0.05192426118391777,"bernard squarcini , former head of the french internal intelligence agency dcri , was quoted in an interview this month as saying : "" the services know perfectly well that all countries , even as they co - operate in the antiterrorist fight , spy on their allies . ""","विमर्प्त खुफिया खुफिया एजेंसी के पूर्व मुखिया को इस मास के एक साक्षात्कार में उद्धृत किया गया था इस मास के एक साक्षात्कार में कहा गया थाः "" सेवाओं को अच्छी तरह से जानते हैं कि सभी देश आपस में लड़ाई में सहयोग , अपने मित्रों के बारे में जानकारी प्राप्त करते हैं . ""","Bernard Squarcini फ्रेंच आंतरिक खुफिया एजेंसी DCRI , के पूर्व प्रमुख , साक्षात्कार में बताते है की : "" सेवाएं अच्छी तरह से जानती है की सारे देश भले ही वे गैर आतंकी लड़ाई में साथ देते है , उनके सहयोगियों पर जासूसी करते है . """
0.21008746148982207,"the americans spy on us on the commercial and industrial level as we spy on them too , because it is in the national interest to defend our businesses .","व्यावसायिक और औद्योगिक स्तर पर हम पर जो व्यंग्य - व्यंग्य हम करते हैं , उनके बारे में हम लोग भी जानते हैं , क्योंकि यह राष्ट्रीय हित में हमारे व्यवसायों की रक्षा करना है ।","अमेरिकि वाणिज्यिक और औद्योगिक स्तर पर हम पर जासूसी करते है और हम भी करते है , क्योंकि यह हमारे कारोबार का बचाव के लिए राष्ट्रीय हित में"
0.12750736437345603,nobody is fooled .,कोई नहीं है ।,कोई भी मूर्ख नहीं बना ।
0.11945225533013985,parents of georgia teen who died in ' freak accident ' believe son was,जिहाद दुर्घटना में मारे जाने वाले नाविकों के माता - पिता के पिता थे,"‘अनोखी दुर्घटना "" में मारे गये जॉर्जिया के किशोर के माता - पिता का मानना है कि उनके बेटे की हत्या की गई"
0.057053631526831045,"the parents of a georgia teenager , whose body was found inside a rolled - up wrestling mat in his high school gym , believe their son was murdered , the family ' s attorney said thursday .","एक विसंगता के माता - पिता , जिसका शरीर अपने हाई स्कूल की भेंटियों में एक रेश - अप वेश्या के भीतर पाया जाता था , उनके पुत्र की हत्या की जाती थी ।","जॉर्जिया के एक किशोर जिसकी मृत शरीर उसके हाई स्कूल जिम में रेस्टलिंग मैट में लपेटा हुआ पाया गया था , का मानना है कि उनके बेटे की हत्या की गई थी , यह बात परिवार के अधिवक्ता ने गुरूवार को कही ।"
0.04071281598834304,"kendrick johnson , of valdosta , ga . , was found jan . 11 stuck in an upright mat propped behind the bleachers inside his high school gym .",11 . जवाहरलाल नेहरू का कहना था कि वे अपने हाई स्कूल की निर्कालिता के पीछे एक स्थायी चटाई में बैठे हुए हैं ।,"वैलडोस्टा , जी . ए . के केन्ड्रिक जॉनसन को 11 जनवरी को उनके हाई स्कूल जिम के अन्दर ब्लीचर्स के पीछे सीधे खड़े मैट में फंसा पाया गया था ।"
0.03747470340545221,"lowndes county sheriff ' s investigators concluded johnson died in a freak accident , but the 17 - year - old ' s family disputes that .","एक विवाह - दुर्घटनाजनक व्यंग्य - विवृति में विमर्प्त व्यंग्य की मृत्यु हुई , किन्तु 17 वर्षीय के पारिवारिक विवादों के कारण ।","लॉन्डेस काउन्टी शेरिफ के जांचकर्ताओं का निष्कर्ष था कि जॉनसन एक ‘अनोखी दुर्घटना’ में मरा था , लेकिन 17 वर्षीय लड़के के परिवार ने इससे इन्कार किया ।"
0.06109350845359499,""" they absolutely think their son was murdered , "" benjamin crump , an attorney representing kenneth and jacquelyn johnson , told foxnews . com .","वे पूरी तरह से सोचते हैं कि उनके पुत्र की हत्या हो गई थी , ' ' विखंडित और निर्वीयता का प्रतिनिधित्व करने वाले एक ही पात्र की हत्या कर दी गई , जिसमें विबंधाता की भावना थी .","केनेथ एवं जैकलीन जॉनसन को प्रस्तुत करने वाले अधिवक्ता बेंजामिन क्रम्प ने फॉक्स न्यूज डॉट कॉम से कहा कि "" उनका पूरी तरह से मानना है कि उनके बेटे की हत्या की गई है "" ।"
0.04553719184146072,they never believed he died the way the sheriff concluded .,वे कभी भी इस बात का विश्वास नहीं करते थे कि तपस्विनी का रास्ता किस तरह समाप्त होता है ।,उन्हें शेरिफ के बताये गये तरीके से मृत्यु पर बिलकुल भी भरोसा नहीं है ।
0.045045567371536595,""" they believe that it defies logic , the laws of physics as well as common sense , "" crump said .","वे मानते हैं कि यह तर्कवाद , भौतिकी के नियमों तथा सामान्य अर्थ के रूप में , "" नम्यता से प्रेरित है .","क्रम्प ने कहा कि "" उनका मानना है कि यह बात शारीरिक नियम एवं सामान्य बुद्धि के तर्क से परे है । """
0.24406980379263402,they think this is a cover - up to protect the person or people responsible for their son ' s death .,वे सोचते हैं कि यह एक आवरण है जो उस व्यक्ति या उसके बेटे की मृत्यु के लिए जिम्मेदार है .,"उन्हें लगता है कि यह निष्कर्ष , उनके बेटे की मृत्यु के लिए जिम्मेदार व्यक्ति या लोगों की सुरक्षा के लिए एक बहाना है ।"
0.20130162159098738,""" they sent their son to school with a book - bag and he was returned to them in a body bag , "" he said .","उन्होंने कहा , "" उन्होंने अपने बेटे को पुस्तक - बैग से स्कूल भेजा और वह अपने शरीर पर सवार हो गया ।","उन्होंने कहा कि "" उन्होंने अपने बेटे को एक बुक - बैक के साथ स्कूल भेजा था , और वह लौटा एक बॉडी बैग में """
0.20282970804972422,"u . s . attorney michael moore said thursday he is conducting a formal investigation into johnson ' s death , noting that several key questions remain unanswered .","यू . विक्टोरिया ने कहा कि वे दमनकारी की मृत्यु की औपचारिक जांच कर रहे हैं , इस बात को ध्यान में रखते हुए कि कई महत्वपूर्ण प्रश्न आएँ हैं ।","यू . एस . महाधिवक्ता माइकल मूलरे ने गुरूवार को कहा कि वह जॉनसन की मृत्यु के बारे में एक औपचारिक जांच कर रहे हैं , यह देखते हुए कि बहुत से महत्वपूर्ण प्रश्न अनुत्तरित हैं ।"
0.20412414523193154,what was the cause of death ?,मृत्यु का क्या कारण था ?,मौत का कारण क्या था ?
0.05868924818816534,was his death the result of a crime ?,उनका निधन अपराध का परिणाम था ?,क्या उसकी हत्या किसी अपराध के कारण हुई ?
0.037017739364892895,moore said at a press conference thursday afternoon .,> > फिर एक प्रेस - कान्फरेन्स में बोली ।,मुरे ने यह बातें गुरूवार को दोपहर में एक पत्रकार सम्मेलन में कही ।
0.07545339613823569,i will follow the facts wherever they lead .,मैं उन तथ्यों का अनुसरण करूंगा जो वे नेतृत्व करते हैं ।,"मैं तथ्यों का अनुपालन करूंगा , वे हमें जहां पर भी ले जाएं ।"
0.2584865769785853,my objective is to discovery the truth .,मेरा उद्देश्य सत्य की खोज करना है ।,मेरा उद्देश्य सत्य को सामने लाना है ।
0.35025412310639736,""" i am of the opinion that a sufficient basis exists "" for a formal investigation , he said .","उन्होंने कहा , ' ' यह राय है कि एक औपचारिक जांच के लिए पर्याप्त आधार मौजूद है .","उन्होंने कहा कि "" मेरा विचार है कि एक औपचारिक जांच के लिए पर्यावरण कारण मौजूद हैं । """
0.1636811804348742,"moore told reporters that the initial autopsy indicated johnson died as a result of "" positional asphyxia . ""","ने रिपोर्टर से कहा कि प्रारंभिक स्मिर्टमार्क ने ' असहिष्णुता ' के परिणाम के रूप में अपनी मृत्यु हो गई है . ""","मूरे ने रिपोर्टर से कहा कि आंरम्भिक शव परीक्षण में संकेत मिलते हैं कि जॉनसन की मृत्यु "" स्थितीय श्वसावरोध "" के परिणामस्वरूप हुई ।"
0.13540654580657827,"a second autopsy , however , listed a different cause of death , according to moore .","फिर भी , विपदाओं के अनुसार , मृत्यु का एक अलग कारण सूचीबद्ध हुआ ।","मूरे के अनुसार , वैसे एक द्वितीय शव परीक्षण में मृत्यु का एक भिन्न कारण पता चला । """
0.06665529878849229,""" there are several questions that must be answered or confirmed , "" he said .","उन्होंने कहा , "" इसके कई प्रश्न हैं या पुष्टि करना ।","उन्होंने कहा कि "" ऐसे बहुत से प्रश्न हैं , जिनका उत्तर मिलना चाहिए या पुष्टि होनी चाहिए । """
0.09352642460185542,moore added that if he uncovers sufficient evidence to warrant a criminal or civil rights investigation into the death of johnson he will ask the fbi to conduct it .,यह भी कहा गया कि यदि वह किसी अपराधी या नागरिक अधिकारों की छानबीन की छानबीन कर देता है तो वह इस बात को स्वीकार करने के लिए अपमानजनक कहता है ।,मूरे ने यह भी कहा कि यदि वह जॉनसन की मृत्यु के मामले में किसी अपराधी को तलब करने अथवा नागरिक अधिकारों की जांच करने के लिए पर्याप्त साक्ष्य पाते हैं तो वह उसे करने के लिए एफ . बी . आई . से कहेंगे ।
0.08301095462822577,a representative from the lowndes county sheriff ' s office was not immediately available for comment when contacted thursday .,विलब्धि के कार्यालय से मिलने वाले प्रतिनिधि को तुरंत इस बात के लिए उपलब्ध नहीं किया गया कि जब से हमसे संपर्क विवाहिकाओं का संबंध है ।,गुरूवार को सम्पर्क किये जाने पर लॉन्डेज काउन्टी शेरिफ के कार्यालय से टिप्पणी के लिए प्रतिनिधि तुरन्त उपलब्ध नहीं था ।
0.06205481658961,a southern georgia judge on wednesday ordered authorities to release all surveillance video that investigators reviewed .,एक दक्षिणी महिला न्यायधीश ने इस बात को आदेश दिया कि वह उन सभी निगरानी विडियो को छोड़ देने का आदेश दे ।,"बुधवार को दक्षिणी जॉर्जिया के न्यायाधीश ने अधिकरियों को , जांचकर्ताओं द्वारा समीक्षा की गई सभी निगरानी वीडियो जारी करने का आदेश दिया ।"
0.12107380731797272,the teenager ' s parents said they hope the video footage will contain clues to how he died .,जिहाद के माता - पिता ने कहा कि ये वीडियो विमर्तों को आशा है कि वे कैसे मर गए हैं ।,लड़के के माता - पिता का कहना है कि उन्हें उम्मीद है कि वीडियो फुटेज से कुछ संकेत मिलेंगे कि उसकी मृत्यु कैसे हुई थी ।
0.03882110458693121,cdc issues children ' s allergy guidelines for,आकस्मिक रूप से बच्चों के विकलांगताओं के लिए दिशानिर्देश,सी . डी . सी . ने विद्यालयों के लिए बच्चों की एलर्जी संबंधी दिशा - निर्देश जारी
0.21312212858880278,"on wednesday , the centers for disease control and prevention released a set of guidelines to manage children ' s food allergies at school .","अशिष्टता , रोग नियंत्रण के लिए केंद्र और स्कूल में बच्चों के भोजन की व्यवस्था करने के लिए दिशा - निर्देश प्रदान करने के लिए दिशानिर्देश जारी करना ।",बुधवार को रोग नियंत्रण और रोकथाम केन्द्र ने विद्यालय में बच्चों की खाद्य एलर्जी नियंत्रित करने के लिए दिशा - निर्देश जारी किए ।
0.15424425779603732,"this is the first set of such guidelines the u . s . government has put out , as the number of school - age children suffering from food allergies climbs .",इस तरह के दिशा - निर्देशों का पहला सेट यह है कि यू . एस . सरकार ने खाद्य - पदार्थों से ग्रस्त बच्चों की संख्या के रूप में उन्हें निकाल दिया है ।,"यू . एस . सरकार द्वारा पहली बार ऐसे दिशा - निर्देश जारी किए गए हैं , क्योंकि विद्यालय जाने वाले बच्चों के खाद्य एलर्जी से पीड़ित होने की संख्या बढ़ रही है ।"
0.11709960242793659,one in 20 children in the united states now have food allergies .,संयुक्त राज्यों में एक २० बच्चों में से एक अब भोजन की छूट है ।,अब यू . एस . में प्रत्येक 20 में से एक बच्चे को खाद्य एलर्जी है ।
0.039288050369421464,the cdc found the prevalence of food allergies among children increased 18 percent between 1997 and 2007 .,सन् 1997 और 2007 में बच्चों के बीच भोजन की व्यापकता 18 प्रतिशत बढ़ी ।,सी . डी . सी ने पाया कि वर्ष 1997 से 2007 के बीच बच्चों में खाद्य एलर्जी के मामलों में 18 प्रतिशत की वृद्धि हुई है ।
0.03826785263229923,"the guide contains information for schools on how to make faculty and staff aware of children ' s food allergies , and how to handle them should an allergic reaction occur .",गाइड के पास बच्चों के खाद्य पदार्थों के बारे में जानकारी और स्टाफ के खाद्य पदार्थों से अवगत होने के बारे में जानकारी दी जाती है ।,"इस दिशा - निर्देश में विद्यालयों के लिए सूचना दी गई है कि शिक्षकों और कर्मचारियों को बच्चों की खाद्य एलर्जी के बारे में किस तरह से सूचित किया जाए , तथा कोई एलर्जिक प्रतिक्रिया होने की स्थिति में , उसे कैसे संभाला जाए ।"
0.023994132504432608,it also recommends schools have epinephrine stocked - - the epipen brand auto - injector being most commonly used - - to respond to potentially fatal anaphylaxis .,यह भी सिफारिश की जाती है कि स्कूलों के विक्षोभ - - - - - - - - - - - - - - - - - - - - - - - - - - - - - - - - - - - - - - - - - - - - - - है ।,विद्यालयों को यह भी सुझाव दिया गया है कि वे संभावित रूप से जानलेवा तीव्रग्राहिता ( एनाफाइलैक्सिस ) का सामना करने के लिए एपीनेफ्राइन का स्टॉक रखें - जो एपीपेन ब्रान्ड का ऑटो - इंजेक्टर है जिसका सबसे आम तौर पर इस्तेमाल किया जाता है ।
0.08658068724738738,state legislatures have recently been updating rules to allow schools to stock epinephrine more easily .,हाल ही में राज्य विधानमंडलों ने अपने स्कूलों को अधिक आसानी से प्रस्तुत करने की अनुमति देने के लिए नये नियम बनाए हैं ।,"राज्य विधानसभा ने हाल ही में नियमों में अद्यतन किया है , जिससे विद्यालय अधिक मात्रा में एपीनेफ्राइन का स्टॉक आसानी से रख सकते हैं ।"
0.21992062963866632,the report also includes a list of typical symptoms communicated by children who are having an allergic reaction .,इस रिपोर्ट में ऐसे बच्चों की एक सूची भी शामिल है जो एलर्जिक प्रतिक्रिया वाले बच्चों द्वारा बताई जाती है ।,इस रिपोर्ट में एलर्जिक प्रतिक्रिया से पीड़ित बच्चों द्वारा संचारित किए जाने वाले आम लक्षणों की सूची भी शामिल है ।
