bleu,x,y,z
0.0840249234336123,"according to sources , under this policy the kerosene quota of punjab , haryana , maharashtra and uttarakhand has been reduced significantly .","इस नीति के अंतर्गत , इस नीति के अंतर्गत आगमों , डोलोमाइट , विकर्षण और विकर्षण का महत्व कम हो गया है ।","सूत्रों के मुताबिक इस नीति के तहत ही पंजाब , हरियाणा , महाराष्ट्र और उत्ताराखंड को केरोसिन कोटा काफी कम किया जा चुका है ।"
0.14692660395121543,the punjab quota of 2 . 72 lakh kilolitres was reduced to one lakh kilolitres .,2 . 72 लाख का विमोचन किया गया ।,पंजाब का कोटा 2 . 72 लाख किलो लीटर से घटा कर एक लाख किलो लीटर किया गया ।
0.04303846266589084,the kerosene quota allocation for haryana was reduced by 70 % and for uttarakhand it was reduced by almost 40 % .,विमोचन के लिए केरोसीन का संचय 70 % तक कम हो गया था और विमोचन के लिए लगभग 40 % की कमी हुई ।,उत्ताराखंड के आवंटन में 70 फीसद तो हरियाणा का केरोसिन कोटा लगभग 40 फीसद घटाया गया ।
0.1248665752519894,despite this reduction no shortage of kerosene has been reported by these states .,इसके बावजूद इन राज्यों द्वारा केरोसीन की कमी नहीं देखी गयी है ।,इस कटौती के बावजूद इन राज्यों से केरोसिन की किल्लत की खबर नहीं आई है ।
0.10830630507021792,the ministry is assuming that it is clear that kerosene is used for adulteration .,मंत्रि - मण्डल को यह समझ लिया जाता है कि केरोसिन के लिए केरोसीन का प्रयोग किया जाता है ।,मंत्रालय मान रहा है कि इससे स्पष्ट है कि केरोसिन का इस्तेमाल मिलावट के लिए होता रहा है ।
0.21099261895175328,the difference in the price of diesel and pds kerosene is currently rs . 37 .,डीजल की कीमत में अंतर और विलिंग्डिटन केरोसीन वर्तमान में है ।,पीडीएस केरोसिन और डीजल की कीमत में इस समय 37 रुपये का अंतर है ।
0.05816635421147516,this encourages those who carrying out adulteration .,यह उन लोगों को बढ़ावा देता है जो एक - दूसरे को धोखा देते हैं ।,इससे मिलावट करने वालों को बढ़ावा मिलता है ।
0.060113024822134986,"in the states where the sale of kerosene through pds shops has been stopped , the oil companies can sell kerosene at full price on the open market .","राज्यों में जहां विडंमी दुकानों के माध्यम से केरोसीन की बिक्री बंद कर दी गई है , तेल कंपनियां , मछली की बिक्री कर सकती हैं ।",जिन राज्यों में पीडीएस के जरिये बिक्री बंद की जाएगी वहां तेल कंपनियां खुले बाजार में पूरी कीमत पर केरोसिन की बिक्री करेंगी ।
0.1035158390396198,at present the oil companies are selling kerosene at a loss of rs . 39 per litre .,वर्तमान में तेल कंपनियों को प्रति लिटर रु . 39 प्रति लिटर की हानि होती है ।,इस समय तेल कंपनियों को केरोसिन पर 39 रुपये प्रति लीटर से ज्यादा का घाटा हो रहा है ।
0.2503023845012661,"the burden of the kerosene subsidy in the year 2013 - 14 is estimated to be 31 , 000 crore rupees .","वर्ष 2013 - 14 में केरोसीन की सब्सिडी का भार 31 , 000 करोड़ रुपए अनुमानित है ।",वर्ष 2013 - 14 में केरोसिन सब्सिडी का बोझ लगभग 31 हजार करोड़ रुपये रहने का अनुमान है ।
0.07604702045223338,"claiming to be a trading firm the accused opened accounts for investors and in the name of selling and purchasing shares , committed fraud .",व्यापारी फर्म बनने का दावा अभियुक्तों ने निवेशकों के लिए और बिक्री और क्रय शेयरों के विक्रय और क्रय के नाम पर खोल दिया है ।,आरोपी ट्रेडिंग फर्म का हवाला देकर निवेशकों के अकाउंट खोलकर शेयर की खरीद - फरोख्त के नाम पर जालसाजी करते थे ।
0.0600122521795505,"it is possibly the first time in the state that this type of fraud , worth crores of rupees , has been discovered and exposed .",यह शायद पहली बार इस प्रकार की धोखाधड़ी है कि इस प्रकार की धोखाधड़ी करोड़ों करोड़ रुपए की होगी ।,संभवत : प्रदेश में पहली बार हुए इस तरह के खुलासे में करोड़ों रुपए की ठगी की बात सामने आई है ।
0.09638946406611006,"the police have not yet been able to catch the leader of the gang , but the police have detained seven people including the accused , after examining his work in the state .","पुलिस ने अभी तक दल का नेता नहीं पकड़ पाया है , लेकिन पुलिस ने अभियुक्तों सहित सात लोगों को राज्य में अपना काम जानने के बाद रोक दिया है ।","गिरोह का सरगना कौन है , फिलहाल पुलिस उस तक नहीं पहुंच पाई है , लेकिन प्रदेश में उसका काम देखने वाले आरोपी समेत सात लोगों को पुलिस ने हिरासत में लिया है ।"
0.03431634827996379,this gang ran a fictitious commodity market named metatrader - 5 .,इस गिरोह ने एक विज्वलनशील वस्तु बाजार का नाम ले लिया ।,यह गिरोह मेटाट्रेडर - 5 के नाम से एक फर्जी कमोडिटी मार्केट संचालित करता था ।
0.0664601628955087,company executives used to take cash from investors and with the help of bogus software used to create fake ids .,निवेशकों से नकद ले जाने के लिए इस्तेमाल किया जाता था और स्कैस्लैंटरों के सॉफ्टवेयर की मदद से नकली आईडी का निर्माण किया जाता था ।,कंपनी के कर्ताधर्ता निवेशकों से नकद रकम लेकर एक फर्जी सॉफ्टवेयर पर फर्जी आईडी बनाकर देते थे ।
0.034857116957065434,"with these , the accused could see the shares the investors were buying .",इन सबके साथ अभियुक्तों को लगा कि निवेशक शेयर खरीद रहे हैं ।,इससे ट्रेडिंग करने पर निवेशकों के खरीदे हुए शेयर आरोपियों को नजर आते थे ।
0.03367425136798257,they also used to known which shares were being purchased and at what price .,वे भी जानते थे कि शेयर खरीदा जा रहा है और किस मूल्य पर ।,उसमें यह तक पता चल जाता था कि कौन सा शेयर किस कीमत पर खरीदा गया था ।
0.09928927969753591,"in reality no shares were purchased , nor any transactions carried out , because no demat account was opened for the investors and share prices were falsely displayed in the fictitious software .","वास्तविक रूप से कोई शेयर खरीदा गया नहीं था , और न ही कोई लेन - देन , क्योंकि निवेशकों और शेयर कीमतों के लिए कोई डीमैट खाता खोला गया था ।","वास्तव में न कोई शेयर खरीदा जाता था और न ही इसके लिए कोई ट्रांजक्शन ही होता था , क्योंकि निवेशकों का कोई डीमेट अकाउंट खोला नहीं जाता था और इस फर्जी सॉफ्टवेयर पर शेयर झूठे दर्शाए जाते थे ।"
0.03435448519978225,police estimate that hundreds of people had been defrauded by the gang .,पुलिस का अनुमान था कि सैकड़ों लोगों को उस गिरोह द्वारा निष्कासित किया गया था ।,पुलिस अंदाजा लगा रही है कि इस गिरोह के झांसे में सैकड़ों लोग आ चुके हैं ।
0.1324317283199537,every investor was asked to invest from two to five lakhs to get good returns .,प्रत्येक निवेशक को बेहतर प्रतिफल प्राप्त करने के लिए दो से पांच लाख लाख से निवेश करने को कहा गया है ।,हर निवेशक से मुनाफा देने के नाम पर दो से पांच लाख रुपए तक निवेश करवाए जाते थे ।
0.023560972414734278,"the main suspect , amit soni , was detained by the cyber cell from jodhpur , while his six associates were arrested in indore .","मुख्य संदिग्ध , स्कैविफागी को साइबर सेल द्वारा रिसीवर से रोक दिया गया जबकि उनके छह साथी असमंजस में गिरफ्तार किये गये ।","इसके मुख्य आरोपी अमित सोनी को सायबर सेल ने जोधपुर से हिरासत में लिया है , जबकि उसके छह अन्य साथियों को इंदौर से पकड़ा गया है ।"
0.21442295602998496,"according to the cyber cell adg , ashok dohare , every stock trading company has to join the stock exchange as a trading firm .","साइबर सेविविविविंग्स , विविविगेशन , प्रत्येक स्टॉाक ट्रेडिंग कंपनी को ट्रेडिंग फर्म के रूप में स्टॉक एक्सचेंज में शामिल होना है ।",एडीजी सायबर सेल अशोक दोहरे के अनुसार किसी भी शेयर ट्रेडिंग कंपनी को स्टॉक एक्सचेंज से ट्रेडिंग फर्म के रूप में जुड़ना जरूरी होता है ।
0.14296145628396553,only after that can the company can get investors to do stock trading through them .,केवल इसके बाद ही कम्प नी निवेशकों को उनके माध्यम से शेयर ट्रेडिंग करने के लिए प्राप्त कर सकती है ।,इसके बाद ही कंपनी अपने जरिए निवेशकों को शेयर ट्रेडिंग करवा सकती है ।
0.1288644336763944,"then the investor ' s demat account is opened , so that the stock can be traded , but this company metatrader - 5 was neither associated with any exchange , nor was carrying out any stock trading .","इसके बाद निवेशक का डीमैट खाता खोला जाता है , ताकि शेयर का व्यापार किया जा सके , लेकिन यह कंपनी विविघन - 5 किसी भी मुद्रा के साथ जुड़ा हुआ नहीं था , न ही किसी स्टॉ क ट्रेडिंग को कार्यान्वित कर रहा था ।","फिर निवेशक का डीमेट अकाउंट खोला जाता है , ताकि उसके लिए शेयर खरीदे - बेचे जा सकें , लेकिन मेटाट्रेडर - 5 नाम की यह कंपनी न तो किसी एक्सचेंज से जुड़ी थी और न ही स्टॉक ट्रेडिंग करवाती थी ।"
0.11409836139776075,this company purchased a server on 24th september 2012 under the name of wintrade .,इस कंपनी ने विलायक के नाम पर 24 जून 2012 को एक सर्वर खरीदा ।,इस कंपनी ने विनट्रेड के नाम से 24 सितंबर 2012 को ट्रेडिंग का हवाला देकर अपने लिए सर्वर खरीदा था ।
0.046309444679305076,since then this company has been defrauding people with fake investments .,इसके बाद से यह कंपनी नकली निवेशों से विस्थापित हो चुकी है ।,तब से ही इस कंपनी के जरिए निवेश के नाम पर लोगों को झांसा दिया जा रहा है ।
0.07158561577277534,"so far , eight traders from indore have come forward with complaints to the cyber cell .",अब तक स्कैस्लैंटों से आठ व्यापारी साइबर कक्ष में शिकायतों के साथ आगे आ गए हैं ।,सायबर सेल में शिकायत करने वाले फिलहाल इंदौर के आठ व्यापारी सामने आए हैं ।
0.09664109864227866,after selling their shares at a profit the amount was not transferred into their accounts .,लाभ पर अपने शेयरों को बेचने के बाद राशि को अपने लेखों में हस्तांतरित नहीं किया गया ।,अपने खरीदे गए शेयर को मुनाफे में बेचने के बाद भी उनकी रकम खाते में ट्रांसफर नहीं हुई ।
0.07141816289329643,then they started asking for the promised profit from the executives of the company .,तब वे कंपनी के कार्यपालकों से वचन लाभ के लिए पूछ शुरू किया ।,इस पर उन्होंने कंपनी के कर्ताधर्ताओं से मुनाफे की रकम मांगनी शुरू की ।
0.1452964737136934,investors are even saying that their fake ids always showed a reduction in the price of their purchased shares .,निवेशकों को यह भी कह रहे हैं कि उनके नकली ब्रांड अपने खरीद शेयर की कीमत में एक कमी दिखाते हैं ।,निवेशक यहां तक कह रहे हैं कि उनको दी गई फर्जी आईडी पर हमेशा उनके खरीदे गए शेयर की कीमत कम दर्शाई जाती थी ।
0.04932351569489709,this price was set by the accused themselves .,अभियुक्तों ने यह मूल्य खुद अभियुक्तों द्वारा तय किया था ।,यह कीमत आरोपी अपने स्तर पर तय कर लेते थे ।
0.08225964699966556,"the company had appointed a ceo and agents in rajasthan , madhya pradesh and maharashtra .","कंपनी ने विस्तीन , विकर्षण और विस्तीन में एक विघ्त और एजेंट नियुक्त किया था ।","कंपनी ने राजस्थान , मप्र और महाराष्ट्र में अपने सीईओ और एजेंट नियुक्तकर रखे हैं ।"
0.11267270561268994,the agents lured people to join the company with promises of very good returns .,एजेंट लोगों को इस कंपनी में शामिल करने के लिए प्रेरित किया जाता है ।,एजेंट लोगों को ज्यादा मुनाफे का लालच देकर इस कंपनी से जुड़ने की सलाह देते थे ।
0.06734850273596513,"thereafter , some people invested between two to five lakh rupees .",इसके बाद कुछ लोगों ने दो - पांच लाख रूपये के बीच निवेश किया ।,इसके बाद किसी से दो लाख तो किसी से पांच लाख रुपए तक जमा करवाए जाते थे ।
0.0760493327903722,the players in this team are setting new test match records everyday and now their reputation in one day tournaments is also increasing .,"इस टीम के खिलाड़ी नए परीक्षण मैच की स्थापना कर रहे हैं , दिन प्रतिदिन रिकार्ड कर रहे हैं और एक दिन में उनकी प्रतिष्ठा भी बढ़ रही है ।",टेस्ट में आए दिन इस टीम के खिलाड़ी नए रिकॉर्ड बनाते रहते हैं और अब वनडे में भी इनका रुतबा धीरे - धीरे बढ़ता नजर आ रहा है ।
0.015594807653828379,"an excellent example of this was when a strong new zealand team was crushed by bangladesh , who had an insurmountable lead and won the one - day series title .","इस का एक उत्कृष्ट उदाहरण यह था जब एक शक्तिशाली नया कांटेट दल विस्तीन द्वारा कुचल दिया गया था , जिसने एक विस्तीन का नेतृत्व किया था और एक दिन की जंजीर को जीत लिया था ।",गुरुवार को इसका एक बेहतरीन उद्हारण भी देखने को मिला जब अच्छी - खासी न्यूजीलैंड की टीम को बांग्लादेश ने वनडे सीरीज में रौंदकर अजेय बढ़त हासिल करते हुए खिताब अपने नाम कर लिया ।
0.018795570273889128,with sohag gazi and musherfe murtaza ' s strong bowling bangladesh defeated new zealand in the second one - day match by 40 runs and gained a insurmountable 2 - 0 lead in the three - match series .,विस्तीन और स्कैलाफागी के सशक्त प्रतिगारों से चालीस पंक्तियों में एक - दूसरे के बंधन में नई द्रोहरों को परास्त कर दिया गया और तीन - चार पंक्तियों में एक सचेतक प्राप्त हुआ ।,सोहाग गाजी और मशरफेमुर्तजा की धारदार गेंदबाजी से बांग्लादेश ने दूसरे वनडे मैच में न्यूजीलैंड को 40 रन से हराकर तीन मैचों की सीरीज में 2 - 0 की अजेय बढ़त हासिल कर ली ।
0.0534741036489421,this is bangladesh ' s sixth consecutive win in one - day matches against new zealand .,यह टेप का छठा मैच है ।,वनडे क्रिकेट में न्यूजीलैंड के खिलाफ यह बांग्लादेश की लगातार छठी जीत है ।
0.05809665204409193,"before this , new zealand had lost the 2010 series to bangladesh by 0 - 4 .","इसके पहले , नया जासूस ने 2010 - 4 के माध्यम से बर्खास्त करने के लिए वर्ष भर खो दिया था ।",इससे पहले न्यूजीलैंड 2010 के बांग्लादेश दौरे में 0 - 4 से सीरीज हार गया था ।
0.03637506461172337,"chasing a target of 248 runs set by bangladesh , the new zealand team lost wickets at regular intervals . the team had piled on 207 runs in 46 . 4 overs from the spin bowling of ghazi ( 34 / 3 ) and the strong bowling of murtaza ( 43 / 3 ) .","विण्डियों द्वारा किए गए डिट्रेल्स के एक लक्ष्य का पीछा किया गया है , नया टेप - दल , नियमित अंतराल पर हो गया है ।","बांग्लादेश के 248 रन के लक्ष्य का पीछा करते हुए न्यूजीलैंड ने गाजी ( 34 / 3 ) की स्पिन और मुर्तजा ( 43 / 3 ) की तूफानी गेंदबाजी के सामने नियमित अंतराल पर विकेट गंवाए , जिससे टीम 46 . 4 ओवर में 207 रन पर ही ढेर हो गई ।"
0.06228496954013445,"new zealand ' s ross taylor made the highest score of 45 , while corey anderson scored 37 runs .","नये सचेतक के डिस्पैच ने 45 वर्ष का सबसे अधिक अंक बनाया , जबकि काविविविविविविविविविविविविविविविविविविविविविविविविविविविविविविविविफ़ियामी की ओर चल दी ।","न्यूजीलैंड की ओर से रॉस टेलर ने सर्वाधिक 45 , जबकि कोरी एंडरसन ने 37 रन बनाए ।"
