bleu,x,y,z
0.05802421244626888,""" small and medium sized companies often lack the experience , personnel and financial resources to protect corporate secrets effectively against unauthorised access , "" the bfv warns in a report .",""" छोटी और मझोली आकार वाली कंपनियों का प्रायः अनुभव , कार्मिक और वित्तीय संसाधनों की कमी होती है , ताकि धोखाधड़ी के विरुद्ध नैगम रहस्यों की रक्षा प्रभावी रूप से की जा सके ।",""" छोटे और मध्यम आकार कंपनिया अक्सर अनुभव के अभाव , कर्मियों और वित्तीय संसाधनों अनधिकृत पहुँच के खिलाफ प्रभावी ढंग से कॉर्पोरेट रहस्य की रक्षा करने के लिए , "" BfV एक रिपोर्ट में चेतावनी देती हैं ।"
0.1291802583371725,the us warns its own companies about economic espionage by other countries .,अन्य देशों द्वारा आर्थिक मंदी के बारे में अपनी कंपनियों को एक - दूसरे के आर्थिक मंदी से अवगत कराना ।,अमेरिका ने अन्य देशों द्वारा अपनी ही कंपनियों की आर्थिक जासूसी के बारे में चेतावनी दी है ।
0.07678852597387159,"the us national intelligence estimate in february named france alongside russia and israel in a second tier of offenders who engage in hacking for economic intelligence , behind china , according to the washington post .","हमारी राष्ट्रीय बुद्धिमत्ता का अनुमान है , जो अपराधियों के एक दूसरे स्तर में है , जो एक दूसरे के दूसरे स्तर में है ।","फ्रांस द वाशिंगटन पोस्ट के अनुसार फ़रवरी में अमेरिकी राष्ट्रीय खुफिया का नाम रूस और इसराइल के साथ चीन के पीछे जो आर्थिक आसूचना , लिए हैकिंग में संलग्न अपराधियों के एक दूसरे टीयर में नामित ।"
0.0036264270632120365,"a board member at a german blue - chip company concurred that when it comes to economic espionage , "" the french are the worst . """,एक विज्वलनशील नीले - - - - - - - - - - - - - - - - - - - - - - - - - - - - - - - - - - - - - - - - - - - - - - - - - - - - - - - - - - - - - - - - - - - - - - - - - - - - - - - - - - - - - - - - - - - - - - - -,"एक जर्मन ब्लू चिप कंपनी के बोर्ड सदस्यके अनुसार जब बात आर्थिक जासूसी करने के लिए आती है , तो "" फ्रेंच सबसे खराब"
0.010224725922587764,"bernard squarcini , former head of the french internal intelligence agency dcri , was quoted in an interview this month as saying : "" the services know perfectly well that all countries , even as they co - operate in the antiterrorist fight , spy on their allies . ""","यह कहते हुए कि वे सभी देशों को इस बात के लिए पूरी तरह जानते हैं कि उन सभी देशों को इस बात की जानकारी दी गई है कि वे सभी देशों को इस बात के लिए पूरी तरह जानते हैं कि उन सभी देशों को , जो उदासीनता के संघर्ष में सहयोग करते हैं , अपने मित्रों पर आक्षेप करते हैं ।","Bernard Squarcini फ्रेंच आंतरिक खुफिया एजेंसी DCRI , के पूर्व प्रमुख , साक्षात्कार में बताते है की : "" सेवाएं अच्छी तरह से जानती है की सारे देश भले ही वे गैर आतंकी लड़ाई में साथ देते है , उनके सहयोगियों पर जासूसी करते है . """
0.2515565919019027,"the americans spy on us on the commercial and industrial level as we spy on them too , because it is in the national interest to defend our businesses .",वाणिज्यिक और औद्योगिक स्तर पर घुसपैठियों की निंदा करने पर हमें भी इस बात की निंदा करनी पड़ती है कि यह हमारे व्यापार की रक्षा के लिए राष्ट्रीय हित में है ।,"अमेरिकि वाणिज्यिक और औद्योगिक स्तर पर हम पर जासूसी करते है और हम भी करते है , क्योंकि यह हमारे कारोबार का बचाव के लिए राष्ट्रीय हित में"
0.06274655310994741,nobody is fooled .,किसी भी प्रकार की निंदा नहीं की जाती ।,कोई भी मूर्ख नहीं बना ।
0.1566391541195429,parents of georgia teen who died in ' freak accident ' believe son was,"अठारह वर्ष के माता - पिता के माता - पिता का निधन हो गया था , जो ' वंदे दुर्घटना ' में मर गये थे ।","‘अनोखी दुर्घटना "" में मारे गये जॉर्जिया के किशोर के माता - पिता का मानना है कि उनके बेटे की हत्या की गई"
0.045273739991036045,"the parents of a georgia teenager , whose body was found inside a rolled - up wrestling mat in his high school gym , believe their son was murdered , the family ' s attorney said thursday .","एक विस्तीन के माता - पिता ने , जिसके शरीर की अपनी हाई स्कूल में एक दरार थी , उसके पिता की हत्या हो गयी , यह विश्वास किया गया कि उनके पुत्र की हत्या हो गयी है ।","जॉर्जिया के एक किशोर जिसकी मृत शरीर उसके हाई स्कूल जिम में रेस्टलिंग मैट में लपेटा हुआ पाया गया था , का मानना है कि उनके बेटे की हत्या की गई थी , यह बात परिवार के अधिवक्ता ने गुरूवार को कही ।"
0.020055042474903074,"kendrick johnson , of valdosta , ga . , was found jan . 11 stuck in an upright mat propped behind the bleachers inside his high school gym .",” रवीन्द्रनाथ ने अपनी हाई स्कूल विस्तीन के भीतर एक सीधी चटाई डाली ।,"वैलडोस्टा , जी . ए . के केन्ड्रिक जॉनसन को 11 जनवरी को उनके हाई स्कूल जिम के अन्दर ब्लीचर्स के पीछे सीधे खड़े मैट में फंसा पाया गया था ।"
0.03425166119071888,"lowndes county sheriff ' s investigators concluded johnson died in a freak accident , but the 17 - year - old ' s family disputes that .","अघोरदत्त की मुद्राऍ समाप्त हो गयी थीं , किन्तु उनके परिवार के 17 वर्ष के परिवार के विवाद भी रहे ।","लॉन्डेस काउन्टी शेरिफ के जांचकर्ताओं का निष्कर्ष था कि जॉनसन एक ‘अनोखी दुर्घटना’ में मरा था , लेकिन 17 वर्षीय लड़के के परिवार ने इससे इन्कार किया ।"
0.07718472611267764,""" they absolutely think their son was murdered , "" benjamin crump , an attorney representing kenneth and jacquelyn johnson , told foxnews . com .","' ' उन्हें पूरी तरह से लगता है कि उनके पुत्र की हत्या कर दी गयी है , ' ' विस्तीन ' , ' वंदे ' और ' विस्तीन ' का प्रतिनिधित्व करता है ।","केनेथ एवं जैकलीन जॉनसन को प्रस्तुत करने वाले अधिवक्ता बेंजामिन क्रम्प ने फॉक्स न्यूज डॉट कॉम से कहा कि "" उनका पूरी तरह से मानना है कि उनके बेटे की हत्या की गई है "" ।"
0.06299392144493404,they never believed he died the way the sheriff concluded .,उन्हें कभी विश्वास नहीं हुआ कि वह इस तरह का फकीर है ।,उन्हें शेरिफ के बताये गये तरीके से मृत्यु पर बिलकुल भी भरोसा नहीं है ।
0.04514970966647375,""" they believe that it defies logic , the laws of physics as well as common sense , "" crump said .","' ' वे मानते हैं कि यह तर्क है , भौतिकी के नियमों , भौतिकी के नियम और समान अर्थ में ।","क्रम्प ने कहा कि "" उनका मानना है कि यह बात शारीरिक नियम एवं सामान्य बुद्धि के तर्क से परे है । """
0.3438557359825754,they think this is a cover - up to protect the person or people responsible for their son ' s death .,"वे सोचते हैं कि यह एक आवरण है , या उनके बेटे की मृत्यु के लिए जिम्मेदार लोगों की रक्षा के लिए एक आवरण है ।","उन्हें लगता है कि यह निष्कर्ष , उनके बेटे की मृत्यु के लिए जिम्मेदार व्यक्ति या लोगों की सुरक्षा के लिए एक बहाना है ।"
0.14960593436705807,""" they sent their son to school with a book - bag and he was returned to them in a body bag , "" he said .",' ' उन्होंने अपने पुत्र को एक किताब के साथ स्कूल भेजा और वह उन्हें शरीर बैग में लौटा दिया गया ।,"उन्होंने कहा कि "" उन्होंने अपने बेटे को एक बुक - बैक के साथ स्कूल भेजा था , और वह लौटा एक बॉडी बैग में """
0.00426878472907377,"u . s . attorney michael moore said thursday he is conducting a formal investigation into johnson ' s death , noting that several key questions remain unanswered .",' ' . . . . . . . . . . . . . . . . . . . . . . . . . . . . . . . . . . . . . . . . . . . . . . . . . . . . . . . . . . . . . . . . . . . . . . . . . . . . . . . . . . . . . . . . . . . . . . . . . .,"यू . एस . महाधिवक्ता माइकल मूलरे ने गुरूवार को कहा कि वह जॉनसन की मृत्यु के बारे में एक औपचारिक जांच कर रहे हैं , यह देखते हुए कि बहुत से महत्वपूर्ण प्रश्न अनुत्तरित हैं ।"
0.7598356856515925,what was the cause of death ?,मृत्यु का कारण क्या था ?,मौत का कारण क्या था ?
0.049230261240159306,was his death the result of a crime ?,उसकी मृत्यु हो गयी थी ।,क्या उसकी हत्या किसी अपराध के कारण हुई ?
0.038685645292085825,moore said at a press conference thursday afternoon .,” “विस्तीन ने एक प्रेस कान्फरेन्स में कहा ।,मुरे ने यह बातें गुरूवार को दोपहर में एक पत्रकार सम्मेलन में कही ।
0.07209140348761812,i will follow the facts wherever they lead .,जहां जहां वे नेतृत्व करते हैं वहां तथ्यों का पालन करेगा ।,"मैं तथ्यों का अनुपालन करूंगा , वे हमें जहां पर भी ले जाएं ।"
0.4111336169005197,my objective is to discovery the truth .,मेरा उद्देश्य सत्य को खोज करना है ।,मेरा उद्देश्य सत्य को सामने लाना है ।
0.16195570128532405,""" i am of the opinion that a sufficient basis exists "" for a formal investigation , he said .",' ' ' इस मत का मत है कि किसी औपचारिक जांच के लिए पर्याप्त आधार मौजूद है ।,"उन्होंने कहा कि "" मेरा विचार है कि एक औपचारिक जांच के लिए पर्यावरण कारण मौजूद हैं । """
0.1365303864589217,"moore told reporters that the initial autopsy indicated johnson died as a result of "" positional asphyxia . """,नियमितता ने रिपोर्टर से कहा कि पहले ही आस्तीन का पता लगाया जा रहा है ।,"मूरे ने रिपोर्टर से कहा कि आंरम्भिक शव परीक्षण में संकेत मिलते हैं कि जॉनसन की मृत्यु "" स्थितीय श्वसावरोध "" के परिणामस्वरूप हुई ।"
0.10249965027589839,"a second autopsy , however , listed a different cause of death , according to moore .","फिर भी , निंदा के अनुसार मृत्यु का एक अलग कारण है ।","मूरे के अनुसार , वैसे एक द्वितीय शव परीक्षण में मृत्यु का एक भिन्न कारण पता चला । """
0.08123368307125367,""" there are several questions that must be answered or confirmed , "" he said .","' ' उन्होंने कहा , “ऐसे कई प्रश्न हैं जो उत्तर या पुष्टि के लिए किये जाने चाहिए ।","उन्होंने कहा कि "" ऐसे बहुत से प्रश्न हैं , जिनका उत्तर मिलना चाहिए या पुष्टि होनी चाहिए । """
0.21055432821605669,moore added that if he uncovers sufficient evidence to warrant a criminal or civil rights investigation into the death of johnson he will ask the fbi to conduct it .,"कैम्पबेल ने यह भी कहा कि यदि वह पर्याप्त साक्ष्य का उल्लंघन करने के लिए पर्याप्त साक्ष्य प्रस्तुत करता है , तो वह हमलावरों से अनुरोध करेगा कि वे उसे धोखा दे दें ।",मूरे ने यह भी कहा कि यदि वह जॉनसन की मृत्यु के मामले में किसी अपराधी को तलब करने अथवा नागरिक अधिकारों की जांच करने के लिए पर्याप्त साक्ष्य पाते हैं तो वह उसे करने के लिए एफ . बी . आई . से कहेंगे ।
0.10062635309001745,a representative from the lowndes county sheriff ' s office was not immediately available for comment when contacted thursday .,जागीरगी के कार्यालय से प्रतिनिधि - मण्डल के प्रतिनिधि - मण्डल के प्रतिनिधि - पद के लिए तत्काल उपलब्ध नहीं थे ।,गुरूवार को सम्पर्क किये जाने पर लॉन्डेज काउन्टी शेरिफ के कार्यालय से टिप्पणी के लिए प्रतिनिधि तुरन्त उपलब्ध नहीं था ।
0.05096045648758293,a southern georgia judge on wednesday ordered authorities to release all surveillance video that investigators reviewed .,श्रीकोयिल पर दक्षिणी गोलार्द्ध का जज ने आदेश दिया कि वे सभी निगरानी कर रहे हैं ।,"बुधवार को दक्षिणी जॉर्जिया के न्यायाधीश ने अधिकरियों को , जांचकर्ताओं द्वारा समीक्षा की गई सभी निगरानी वीडियो जारी करने का आदेश दिया ।"
0.13503037054275394,the teenager ' s parents said they hope the video footage will contain clues to how he died .,कैम्पबेल के माता - पिता ने कहा था कि उसकी मृत्यु के लिए वीडियो - विलेजों को छालेगा ।,लड़के के माता - पिता का कहना है कि उन्हें उम्मीद है कि वीडियो फुटेज से कुछ संकेत मिलेंगे कि उसकी मृत्यु कैसे हुई थी ।
0.06328773820616561,cdc issues children ' s allergy guidelines for,विज्वलनशील मुद्दों के लिए बच्चों के एलर्जी दिशानिर्देश,सी . डी . सी . ने विद्यालयों के लिए बच्चों की एलर्जी संबंधी दिशा - निर्देश जारी
0.11145671749607032,"on wednesday , the centers for disease control and prevention released a set of guidelines to manage children ' s food allergies at school .","विस्तीन पर , रोग नियंत्रण के लिए केंद्र और विद्यालय में बच्चों के खाद्य - प्रसार के लिए दिशानिर्देश जारी करने के लिए दिशानिर्देश जारी करना ।",बुधवार को रोग नियंत्रण और रोकथाम केन्द्र ने विद्यालय में बच्चों की खाद्य एलर्जी नियंत्रित करने के लिए दिशा - निर्देश जारी किए ।
0.16210710960283736,"this is the first set of such guidelines the u . s . government has put out , as the number of school - age children suffering from food allergies climbs .","इस प्रकार के दिशा - निर्देशों का पहला सेट , यू . एस . सरकार ने भोजन - स्फीति से पीड़ित बच्चों की संख्या के रूप में कार्य किया है ।","यू . एस . सरकार द्वारा पहली बार ऐसे दिशा - निर्देश जारी किए गए हैं , क्योंकि विद्यालय जाने वाले बच्चों के खाद्य एलर्जी से पीड़ित होने की संख्या बढ़ रही है ।"
0.11434735332025597,one in 20 children in the united states now have food allergies .,अब संयुक्त राज्य में 20 बच्चों में से एक है ।,अब यू . एस . में प्रत्येक 20 में से एक बच्चे को खाद्य एलर्जी है ।
0.2128482203656297,the cdc found the prevalence of food allergies among children increased 18 percent between 1997 and 2007 .,विण्डित ने वर्ष 1997 और 2007 के बीच बच्चों में कुल 18 प्रतिशत की वृद्धि की ।,सी . डी . सी ने पाया कि वर्ष 1997 से 2007 के बीच बच्चों में खाद्य एलर्जी के मामलों में 18 प्रतिशत की वृद्धि हुई है ।
0.07051255156645433,"the guide contains information for schools on how to make faculty and staff aware of children ' s food allergies , and how to handle them should an allergic reaction occur .","गाइड में विद्यालय के लिए बच्चों के खाद्य और कर्मचारियों को जागरूक करने के बारे में जानकारी प्राप्त करने के बारे में जानकारी दी जाती है , और उन्हें किस प्रकार एलर्जी प्रतिक्रिया होना चाहिए ।","इस दिशा - निर्देश में विद्यालयों के लिए सूचना दी गई है कि शिक्षकों और कर्मचारियों को बच्चों की खाद्य एलर्जी के बारे में किस तरह से सूचित किया जाए , तथा कोई एलर्जिक प्रतिक्रिया होने की स्थिति में , उसे कैसे संभाला जाए ।"
0.020748032380469624,it also recommends schools have epinephrine stocked - - the epipen brand auto - injector being most commonly used - - to respond to potentially fatal anaphylaxis .,यह भी इस बात की सिफारिश करता है - - विस्ट्रेट - - - - - - - - - - - - - - - - - - - - - - - - - - - ।,विद्यालयों को यह भी सुझाव दिया गया है कि वे संभावित रूप से जानलेवा तीव्रग्राहिता ( एनाफाइलैक्सिस ) का सामना करने के लिए एपीनेफ्राइन का स्टॉक रखें - जो एपीपेन ब्रान्ड का ऑटो - इंजेक्टर है जिसका सबसे आम तौर पर इस्तेमाल किया जाता है ।
