bleu,x,y,z
0.14535768424205484,a black box in your car ?,अपने कार में एक काले बक्से ?,आपकी कार में ब्लैक बॉक्स ?
0.0012080992739760277,"as america ' s road planners struggle to find the cash to mend a crumbling highway system , many are beginning to see a solution in a little black box that fits neatly by the dashboard of your car .",. . . . . . . . . . . ।,"जबकि अमेरिका के सड़क योजनाकार , ध्वस्त होते हुए हाईवे सिस्टम को सुधारने के लिए धन की कमी से जूझ रहे हैं , वहीं बहुत - से लोग इसका समाधान छोटे से ब्लैक बॉक्स में देख रहे हैं , जो आपकी कार के डैशबोर्ड पर सफ़ाई से फिट हो जाता है ।"
0.07731250085762993,"the devices , which track every mile a motorist drives and transmit that information to bureaucrats , are at the center of a controversial attempt in washington and state planning offices to overhaul the outdated system for funding america ' s major roads .","प्रत्येक मील के एक विमोचन मार्ग में , जो कि प्रत्येक मील का एक विमोचन मार्ग है और यह बताता है कि विलिंग्गी की मुख्य सड़कों को वित्तपोषित करने के लिए पुरानी प्रणाली को बाधित करने के लिए विस्तीन और राज्य नियोजन कार्यालयों में एक विवादास्पद प्रयास किया जाता है ।","यह डिवाइस , जो मोटर - चालक द्वारा वाहन चलाए गए प्रत्येक मील को ट्रैक करती है तथा उस सूचना को अधिकारियों को संचारित करती है , आजकल अमेरिका की प्रमुख सड़कों का वित्त - पोषण करने के लिए पुराने हो चुके सिस्टम का जीर्णोद्धार करने के लिए वाशिंगटन और राज्य नियोजन कार्यालय के लिए एक विवादास्पद प्रयास का मुद्दा बन चुका है ।"
0.1184945914614132,the usually dull arena of highway planning has suddenly spawned intense debate and colorful alliances .,राजमार्ग योजना के आम तौर पर नीरस होने के कारण अचानक वाद - विवाद और विसंबध्द हो गया है ।,आम तौर पर हाईवे नियोजन जैसा उबाऊ काम भी अचानक गहन बहस तथा जीवंत गठबंधनों का मुद्दा बन गया है ।
0.07872009835106299,"libertarians have joined environmental groups in lobbying to allow government to use the little boxes to keep track of the miles you drive , and possibly where you drive them - then use the information to draw up a tax bill .","सरकार ने अपने आप को दूर करने के लिए अपने छोटे - छोटे बक्से का प्रयोग करने की इजाजत दे दी है , और अगर आप उन्हें आगे धकेलने के लिए छोटे बक्से का प्रयोग करें , तो आप इस सूचना का उपयोग करें ।","आपने द्वारा ड्राइव किए गए मील , तथा संभवतः ड्राइव किए गए स्थान का विवरण रखने - और फिर इस सूचना का उपयोग टैक्स बिल तैयार करने के लिए - सरकार को इन ब्लैक बॉक्स का उपयोग करने की अनुमति देने के पक्ष में समर्थन जुटाने के लिए लिबरेटेरियन पर्यावरणीय समूहों के साथ मिल गए हैं ।"
0.2295748846661433,the tea party is aghast .,चाय पार्टी अस्तव्यस्त होती है ।,चाय पार्टी भौचक्की है ।
0.10273327819011903,"the american civil liberties union is deeply concerned , too , raising a variety of privacy issues .","हमलावर नागरिक स्वतंत्रता संघ का संबंध बहुत अधिक है , जो अनेक प्रकार के गोपनीय मुद्दों का निर्माण करता है ।",अमेरिकी नागरिक स्वतंत्रता संघ भी विभिन्न प्रकार के गोपनीयता मुद्दे उठाते हुए बहुत चिंतित है ।
0.0509052652774011,"and while congress can ' t agree on whether to proceed , several states are not waiting .","और जब कांग्रेस आगे बढ़ने के लिए सहमत नहीं है , तब अनेक राज्यों की प्रतीक्षा नहीं की जा सकती ।","जबकि कांग्रेस इस बात पर सहमत नहीं हो सकी कि आगे की कार्यवाही करनी है या नहीं , बहुत से राज्य प्रतीक्षा नहीं कर रहे ।"
0.139800134566647,"they are exploring how , over the next decade , they can move to a system in which drivers pay per mile of road they roll over .","वे की खोज कर रहे हैं , अगले दशक से अधिक , वे एक प्रणाली में ले जाया जा सकता है , जिसमें एक मील के लिए एक मील प्रति मील का भुगतान करते हैं ।","वे यह खोज कर रहे हैं कि अगले दशक में वे किस तरह से ऐसी प्रणाली में जा सकते हैं , जिसमें चालक सड़क पर तय किए गए प्रत्येक मील के लिए भुगतान करे ।"
0.130505759862203,"thousands of motorists have already taken the black boxes , some of which have gps monitoring , for a test drive .","हजारों मुहरों ने पहले ही काले बक्से को ले लिया है , जिनमें से कुछ ने एक परीक्षण अभियान के लिए मालिश की है ।","हजारों मोटर - चालकों ने टेस्ट ड्राइव के लिए पहले ही ब्लैक बॉक्स ले लिया है , जिसमें से कुछ में जी . पी . एस . मॉनीटरिंग है ।"
0.32649710286280526,this really is a must for our nation .,यह वास्तव में हमारे देश के लिए एक आवश्यक है ।,यह हमारे देश के लिए वास्तव में अनिवार्य वस्तु है ।
0.030673751051174074,""" it is not a matter of something we might choose to do , "" said hasan ikhrata , executive director of the southern california assn . of governments , which is planning for the state to start tracking miles driven by every california motorist by 2025 .","” “यह कोई बात नहीं है कि हम क्या करें , यह बात कुछ न कुछ है , बल्कि सरकार के दक्षिणी गोलार्द्ध के कार्यपालक निदेशक ने कहा है , जो कि प्रत्येक विलायक द्वारा हर बार की गई यात्रा की यात्रा शुरू करने के लिए राज्य की योजना है ।",""" यह हमारे द्वारा चुने या नहीं चुने जाने का विषय नहीं है "" यह कहना है हसन इखराता का जो दक्षिण कैलीफोर्निया सरकार संघ के कार्यकारी निदेशक हैं , जो वर्ष 2025 तक कैलीफोर्निया में मोटर - चालकों द्वारा तय किए गए प्रत्येक मील को ट्रैक करने की शुरुआत करने की योजना बना रहा है ।"
0.15989214998944032,there is going to be a change in how we pay these taxes .,वहाँ कैसे हम इन करों भुगतान में एक परिवर्तन किया जा करने के लिए जा रहा है ।,हमारे द्वारा कर भुगतान किए जाने के तरीके में परिवर्तन होने जा रहा है ।
0.3217294420803809,the technology is there to do it .,प्रौद्योगिकी यह करने के लिए है ।,ऐसा करने के लिए प्रौद्योगिकी है ।
0.07875640265740676,"the push comes as the country ' s highway trust fund , financed with taxes americans pay at the gas pump , is broke .","देश के राजमार्ग विश्वास कोष के रूप में उभर कर आता है , गैस पम्प में करों के भुगतान के साथ वित्त - पोषण किया जाता है ।","ऐसा होने का मुख्य कारण यह है कि देश का हाईवे ट्रस्ट फ़ंड लगभग दिवालिया हो गया है , जिसका वित्त - पोषण अमेरिकी नागरिकों द्वारा गैस पम्प पर किए जाने वाले करों के भुगतान से होता है ।"
0.03737437943747671,americans don ' t buy as much gas as they used to .,विलिंग्गी उतनी गैस के रूप में नहीं खरीदा जितना वे इस्तेमाल करते थे ।,अमेरिकी लोग अब पहले जितनी गैस नहीं खरीदते ।
0.046192151051305474,cars get many more miles to the gallon .,बहुत से लोग गैलन में से कई मील तक लंबे होते हैं ।,अब एक गैलन गैस में कार पहले से अधिक मील चलती है ।
0.16002352088305538,"the federal tax itself , 18 . 4 cents per gallon , hasn ' t gone up in 20 years .","20 वर्ष में संघीय कर स्वयं , 18 . 4 सेंट गैलन में नहीं आया है ।","फेडरल टैक्स में पिछले 20 वर्षों में कोई बढ़ोतरी नहीं हुई , जो 18 . 4 सेंट प्रति गैलन है ।"
0.028720444080221157,politicians are loath to raise the tax even one penny when gas prices are high .,"राजनीतिज्ञों को जब गैस की कीमतें अधिक होती हैं , तब तक एक विलायक भी कर सकता है ।",गैस के उच्च मूल्य होने के कारण राजनेता टैक्स में एक पैसा भी वृद्धि करने से परहेज करते हैं ।
0.11162938527547607,""" the gas tax is just not sustainable , "" said lee munnich , a transportation policy expert at the university of minnesota .","' ' गैस कर केवल स्थायी नहीं है , "" विलिंग्फागी ' के विश्वविद्यालय पर एक परिवहन नीति विशेषज्ञ कहा जाता है ।","मिनेसोटा विश्वविद्यालय में परिवहन नीति विशेषज्ञ ली मुनिख कहते हैं , "" गैस कर बिल्कुल संवहनीय नहीं है । """
0.12962472880491877,his state recently put tracking devices on 500 cars to test out a pay - by - mile system .,राज्य के हाल ही में उन्हें 500 कारों को एक भुगतान प्रणाली की जांच करने के लिए 500 कारों की जांच करनी पड़ी ।,उनके राज्य ने प्रति - मील भुगतान प्रणाली का परीक्षण करने के लिए हाल ही में 500 कारों में ट्रैकिंग डिवाइस लगाई है ।
0.17537670874647399,""" this works out as the most logical alternative over the long term , "" he said .",""" यह लंबे समय तक सबसे अधिक तर्कसंगत विकल्प के रूप में यह काम करता है , उसने कहा ।","वे कहते हैं , "" दीर्घकाल में यह सबसे अधिक तर्कपूर्ण विकल्प के रूप में काम करेगा । """
0.053001566897562975,wonks call it a mileage - based user fee .,विलिंग्चन ने इसे एक विविघन आधारित प्रयोक्ता शुल्क कहा है ।,वॉन्क्स इसे माइलेज - आधारित उपयोगकर्ता शुल्क कहते हैं ।
0.14345842784888513,"it is no surprise that the idea appeals to urban liberals , as the taxes could be rigged to change driving patterns in ways that could help reduce congestion and greenhouse gases , for example .","यह कोई आश्चर्य की बात नहीं है कि विचार शहरी विविगारों की अपील करते हैं , क्योंकि कर में आने वाली वस्तुओं और ग्रीनहाउस गैसों को कम करने में मदद कर सकता है ।","यह आश्चर्य की बात नहीं है कि यह विचार शहरी उदारवादियों को अच्छा लग रहा है , क्योंकि इससे , उदाहरण के लिए कार चलाने के तौर - तरीके में परिवर्तन करने के लिए करों में बदलाव किया जा सकता है , जो जाम कम करने तथा ग्रीनहाउस गैस कम करने में सहायता कर सकता है ।"
0.1266040206174012,california planners are looking to the system as they devise strategies to meet the goals laid out in the state ' s ambitious global warming laws .,स्कैस्कैशर इस प्रणाली को देख रहे हैं क्योंकि वे राज्य के महत्वाकांक्षी वैश्विक ताप कानूनों में निर्धारित लक्ष्यों को पूरा करने के लिए रणनीति तैयार करते हैं ।,कैलीफोर्निया के योजनाकार इस सिस्टम के लिए उत्सुक हैं जबकि वे राज्य के महात्वाकांक्षी ग्लोबल वार्मिंग कानूनों में निर्धारित लक्ष्य पूर्ण करने के लिए रणनीतियाँ विकसित कर रहे हैं ।
0.1609470441750662,"but rep . bill shuster ( r - pa . ) , chairman of the house transportation committee , has said he , too , sees it as the most viable long - term alternative .","लेकिन विलिंग्नी बिल का अध्यक्ष , गृह परिवहन समिति के अध्यक्ष ने भी कहा है , वे भी इसे सबसे अधिक व्यवहार्य विकल्प के रूप में देखते हैं ।","लेकिन गृह परिवहन समिति के अध्यक्ष , रिप . बिल शुस्टर ( आ . - पी . ए . ) भी ब्लैक बॉक्स को सबसे व्यवहार्य दीर्घकालिक विकल्प मानते हैं ।"
0.05108099332943181,the free marketeers at the reason foundation are also fond of having drivers pay per mile .,कारण आधार पर मुक्त स्लेजों को भी एक मील प्रति मील की वेतन देने का शौक है ।,रीजन फ़ाउंडेशन में स्वतंत्र विक्रेता भी चालक द्वारा प्रति मील भुगतान के पक्ष में हैं ।
0.15900779461556444,""" this is not just a tax going into a black hole , "" said adrian moore , vice president of policy at reason .",” “यह सिर्फ एक ऐसा कर नहीं है जो एक काला - सा कर रहा है ।,"रीजन में पॉलिसी के उपाध्यक्ष , एड्रियन मूर ने कहा , "" यह मात्र ऐसा कर नहीं है जो अंधे कुएँ में जा रहा है । """
0.16042062210971325,people are paying more directly into what they are getting .,लोग अधिक सीधे भुगतान कर रहे हैं जो वे हो रही हैं ।,"लोग जो चीज प्राप्त कर रहे हैं , उसके लिए अधिक प्रत्यक्ष रूप से भुगतान कर रहे हैं ।"
0.0055181981815116,"the movement is also bolstered by two former u . s . transportation secretaries , who in a 2011 report urged congress to move in the pay - per - mile direction .",इस आंदोलन में दो पूर्व की ढुलाई की गई है ।,"इस अभियान को दो भूतपूर्व अमेरिकी परिवहन सचिवों ने भी समर्थन दिया है , जिन्होंने वर्ष 2011 में अपनी रिपोर्ट में कांग्रेस से प्रति - मील भुगतान की दिशा में आगे बढ़ने का अनुग्रह किया था ।"
0.17576258836151093,"the u . s . senate approved a $ 90 - million pilot project last year that would have involved about 10 , 000 cars .","यू . एस . ने पिछले वर्ष एक $ 90 करोड़ प्रायोगिक परियोजना की मंजूरी दी , जिसमें लगभग 10 , 000 कारों को शामिल किया गया होगा ।","यू . एस . सीनेट ने पिछले वर्ष 90 - मिलियन डॉलर की परीक्षण परियोजना स्वीकृत की थी , जिसमें 10 , 000 कारें शामिल हो गई होतीं ।"
0.06829079290425194,"but the house leadership killed the proposal , acting on concerns of rural lawmakers representing constituents whose daily lives often involve logging lots of miles to get to work or into town .","लेकिन घर के नेतृत्व ने इस प्रस्ताव को मार दिया , ग्रामीण बूचड़ों की चिंताओं पर अभिनय किया , जिनके दैनिक जीवन प्रायः एक - दूसरे के साथ काम करने के लिए या शहर में हो जाते थे ।","लेकिन ग्रामीण विधि - निर्माताओं की चिंताओं पर काम करते हुए , जो ऐसे व्यक्तियों का प्रतिनिधि कर रहे थे जिन्हें रोजाना काम पर जाने अथवा शहर में जाने के लिए बहुत अधिक मील चलना पड़ता है , सदन के नेतृत्व ने उस प्रस्ताव को वहीं पर समाप्त कर दिया ।"
0.18982137345986203,several states and cities are nonetheless moving ahead on their own .,अनेक राज्यों और नगरों में अपने आप से आगे बढ़ रहे हैं ।,फिर भी बहुत से राज्य और शहर खुद - ब - खुद इस दिशा में आगे बढ़ रहे हैं ।
0.07099180319683496,"the most eager is oregon , which is enlisting 5 , 000 drivers in the country ' s biggest experiment .",सर्वाधिक उत्सुक है कि देश के सबसे बड़ा प्रयोग किया जा रहा है ।,"इसमें सबसे अधिक इच्छुक ऑरेगोन है , जिसने देश के सबसे बड़े प्रयोग में 5 , 000 चालक सूचीबद्ध किए हैं ।"
0.3457913759237496,those drivers will soon pay the mileage fees instead of gas taxes to the state .,उन चालकों ने शीघ्र ही राज्य को गैस कर के बदले विमोचन शुल्क का भुगतान किया है ।,ये चालक जल्द ही राज्य को गैस कर के बजाय माइलेज शुल्क का भुगतान करेंगे ।
0.09080027618567452,nevada has already completed a pilot .,कपालकुण्डला ने एक प्रायोगिक सिद्ध कर दिया है ।,नेवाडा ने पहले ही प्रारंभिक परीक्षण पूर्ण कर लिया है ।
0.08171014300726602,new york city is looking into one .,नये विघोड़े शहर में एक नजर आ रही है ।,न्यू यॉर्क शहर भी इस दिशा में आगे बढ़ रहा है ।
0.24088562704853508,illinois is trying it on a limited basis with trucks .,कैम्पबेल को ट्रकों के साथ सीमित आधार पर आजमाया जाता है ।,इलिनोइस सीमित आधार पर ट्रकों के साथ आज़माइश कर रहा है ।
