bleu,x,y,z
0.09652434877402241,the second criterion is the lpg supply network .,दूसरा मानदण्ड है रिफ्यूटिंग नेटवर्क .,दूसरा आधार एलपीजी कनेक्शन है ।
0.04516764408276343,this means that in those states where most households in the rural areas have gas connections the sale of pds kerosene will be stopped .,इसका मतलब यह है कि उन राज्यों में जहां ग्रामीण इलाकों के अधिकांश घरों में बिजली की मात्रा से पानी का संबंध है ।,"यानी जिन राज्यों के अधिकांश ग्रामीण परिवारों को रसोई गैस कनेक्शन दिए जा चुके हैं , वहां पीडीएस केरोसिन की बिक्री बंद की जा रही है ।"
0.0711586419732111,the petroleum ministry is fully prepared for this .,इसके लिए पेट्रोलियम मंत्रालय तैयार है ।,इस बारे में पेट्रोलियम मंत्रालय ने पुख्ता तैयारी कर ली हैं ।
0.1164394847706997,since october 2013 the sale of pds kerosene in delhi has already been stopped .,सन् 2013 के बाद से दिल्ली में बेफासीन की बिक्री की बिक्री रोक दी गई है .,"अक्टूबर , 2013 से दिल्ली में पीडीएस केरोसिन की बिक्री पहले ही बंद हो चुकी है ।"
0.13523285066501545,"according to sources , under this policy the kerosene quota of punjab , haryana , maharashtra and uttarakhand has been reduced significantly .","स्रोतों के अनुसार इस नीति के तहत जिहाद , निर्मुक्ति , निर्मुक्ति और विपत्तियों का मिट्टी का तेल भी काफी कम कर दिया गया है ।","सूत्रों के मुताबिक इस नीति के तहत ही पंजाब , हरियाणा , महाराष्ट्र और उत्ताराखंड को केरोसिन कोटा काफी कम किया जा चुका है ।"
0.16102642769112474,the punjab quota of 2 . 72 lakh kilolitres was reduced to one lakh kilolitres .,2 . 72 लाख अस्पृश्यों की संख्या एक लाख को कम कर दी गयी ।,पंजाब का कोटा 2 . 72 लाख किलो लीटर से घटा कर एक लाख किलो लीटर किया गया ।
0.04207993129078362,the kerosene quota allocation for haryana was reduced by 70 % and for uttarakhand it was reduced by almost 40 % .,अनियमितताओं के लिए केरोसीन कोटा का आवंटन 70 % कर दिया गया था और अछूतों के लिए लगभग 40 % कम कर दिया गया था ।,उत्ताराखंड के आवंटन में 70 फीसद तो हरियाणा का केरोसिन कोटा लगभग 40 फीसद घटाया गया ।
0.12942148324473518,despite this reduction no shortage of kerosene has been reported by these states .,इसके बावजूद इन राज्यों ने केरोसीन की कमी की कोई कमी नहीं की है ।,इस कटौती के बावजूद इन राज्यों से केरोसिन की किल्लत की खबर नहीं आई है ।
0.23185078121230157,the ministry is assuming that it is clear that kerosene is used for adulteration .,मंत्रालय यह मान रहा है कि यह स्पष्ट है कि मिट्टी के लिए केरोसीन का इस्तेमाल किया जाता है ।,मंत्रालय मान रहा है कि इससे स्पष्ट है कि केरोसिन का इस्तेमाल मिलावट के लिए होता रहा है ।
0.07188959550044094,the difference in the price of diesel and pds kerosene is currently rs . 37 .,वर्तमान में डीजल और तेल की कमी की कीमतों में अंतर वर्तमान में है ।,पीडीएस केरोसिन और डीजल की कीमत में इस समय 37 रुपये का अंतर है ।
0.03737437943747671,this encourages those who carrying out adulteration .,यह उन लोगों को प्रोत्साहित करता है जो अशिष्टता को दूर करते हैं ।,इससे मिलावट करने वालों को बढ़ावा मिलता है ।
0.1336732667637646,"in the states where the sale of kerosene through pds shops has been stopped , the oil companies can sell kerosene at full price on the open market .","उन राज्यों में जहां रियायत की दुकानों के जरिए केरोसीन की बिक्री बंद कर दी गई है , वहां तेल की कंपनियां खुले बाजार में केरोसिन बेच सकती हैं ।",जिन राज्यों में पीडीएस के जरिये बिक्री बंद की जाएगी वहां तेल कंपनियां खुले बाजार में पूरी कीमत पर केरोसिन की बिक्री करेंगी ।
0.06585833693600902,at present the oil companies are selling kerosene at a loss of rs . 39 per litre .,वर्तमान में तेल कंपनियां आर . 39 प्रति लीटर की हानि पर मिट्टी की बिक्री कर रही है ।,इस समय तेल कंपनियों को केरोसिन पर 39 रुपये प्रति लीटर से ज्यादा का घाटा हो रहा है ।
0.2503023845012661,"the burden of the kerosene subsidy in the year 2013 - 14 is estimated to be 31 , 000 crore rupees .","वर्ष 2013 - 14 में मिट्टी की सब्सिडी का भार 31 , 000 करोड़ रुपए अनुमानित है ।",वर्ष 2013 - 14 में केरोसिन सब्सिडी का बोझ लगभग 31 हजार करोड़ रुपये रहने का अनुमान है ।
0.07239768078888709,"claiming to be a trading firm the accused opened accounts for investors and in the name of selling and purchasing shares , committed fraud .",यह दावा किया गया कि अभियुक्त ने निवेशकों के लिए तथा शेयरों की बिक्री और खरीद के नाम पर एक कारोबारी कंपनी होने का दावा किया है ।,आरोपी ट्रेडिंग फर्म का हवाला देकर निवेशकों के अकाउंट खोलकर शेयर की खरीद - फरोख्त के नाम पर जालसाजी करते थे ।
0.059283300616380014,"it is possibly the first time in the state that this type of fraud , worth crores of rupees , has been discovered and exposed .","राज्य में यह शायद पहली बार है कि इस तरह की धोखाधड़ी , करोड़ों रूपये की रकम , खोज और पर्दाफाश की गई है ।",संभवत : प्रदेश में पहली बार हुए इस तरह के खुलासे में करोड़ों रुपए की ठगी की बात सामने आई है ।
0.0932059611377004,"the police have not yet been able to catch the leader of the gang , but the police have detained seven people including the accused , after examining his work in the state .","पुलिस ने अभी तक दल के नेता को पकड़ नहीं पाया है , लेकिन पुलिस ने इस राज्य में अपने कार्य की जांच करने के बाद सात लोगों को बर्खास्त कर दिया है ।","गिरोह का सरगना कौन है , फिलहाल पुलिस उस तक नहीं पहुंच पाई है , लेकिन प्रदेश में उसका काम देखने वाले आरोपी समेत सात लोगों को पुलिस ने हिरासत में लिया है ।"
0.05508583800214239,this gang ran a fictitious commodity market named metatrader - 5 .,इस गिरोह का नाम था रेविसल - 5 .,यह गिरोह मेटाट्रेडर - 5 के नाम से एक फर्जी कमोडिटी मार्केट संचालित करता था ।
0.07832899330004495,company executives used to take cash from investors and with the help of bogus software used to create fake ids .,निवेशकों से नकद ले जाने और नकली आईडी बनाने के लिए इस्तेमाल किए जाने वाले विभेगी सॉफ्टवेयर की सहायता से कंपनी अधिकारी ।,कंपनी के कर्ताधर्ता निवेशकों से नकद रकम लेकर एक फर्जी सॉफ्टवेयर पर फर्जी आईडी बनाकर देते थे ।
0.034857116957065434,"with these , the accused could see the shares the investors were buying .",इनके साथ अभियुक़्तों को भी निवेशकों को खरीद कर दिखा सकते थे .,इससे ट्रेडिंग करने पर निवेशकों के खरीदे हुए शेयर आरोपियों को नजर आते थे ।
0.11306082351602983,they also used to known which shares were being purchased and at what price .,उन्हें भी यह ज्ञात होता था कि कौन सी शेयर खरीद रही हैं और कौन कीमत पर ।,उसमें यह तक पता चल जाता था कि कौन सा शेयर किस कीमत पर खरीदा गया था ।
0.08712018183837662,"in reality no shares were purchased , nor any transactions carried out , because no demat account was opened for the investors and share prices were falsely displayed in the fictitious software .","वास्तव में कोई भी शेयर खरीद नहीं लिया गया और न ही कोई लेनदेन किया गया , क्योंकि निवेशकों के लिए कोई भराई खाता खोला नहीं गया और शेयर - बाजार में शेयर के दाम भी दिए गए ।","वास्तव में न कोई शेयर खरीदा जाता था और न ही इसके लिए कोई ट्रांजक्शन ही होता था , क्योंकि निवेशकों का कोई डीमेट अकाउंट खोला नहीं जाता था और इस फर्जी सॉफ्टवेयर पर शेयर झूठे दर्शाए जाते थे ।"
0.06522424239776402,police estimate that hundreds of people had been defrauded by the gang .,पुलिस का अनुमान है कि सैकड़ों लोग बेसल थे ।,पुलिस अंदाजा लगा रही है कि इस गिरोह के झांसे में सैकड़ों लोग आ चुके हैं ।
0.15071676257541072,every investor was asked to invest from two to five lakhs to get good returns .,प्रत्येक निवेशक को अच्छा लाभ प्राप्त करने के लिए दो से पांच लाख रूपये का निवेश करना पड़ा ।,हर निवेशक से मुनाफा देने के नाम पर दो से पांच लाख रुपए तक निवेश करवाए जाते थे ।
0.0409608163074695,"the main suspect , amit soni , was detained by the cyber cell from jodhpur , while his six associates were arrested in indore .","मुख्य संदेह , डकैती , वितृष्णा से साइबर सेल द्वारा रोक ली गयी थी , जबकि उनके छह सहयोगियों को जिहाद में गिरफ्तार कर लिया गया ।","इसके मुख्य आरोपी अमित सोनी को सायबर सेल ने जोधपुर से हिरासत में लिया है , जबकि उसके छह अन्य साथियों को इंदौर से पकड़ा गया है ।"
0.11902001907030836,"according to the cyber cell adg , ashok dohare , every stock trading company has to join the stock exchange as a trading firm .","साइबर कोशिका विक्षोभ , विक्षोभ , प्रत्येक शेयर व्यापारी कंपनी के अनुसार शेयर - बाजार के रूप में स्टॉक एक्सचेंज में शामिल होना होता है ।",एडीजी सायबर सेल अशोक दोहरे के अनुसार किसी भी शेयर ट्रेडिंग कंपनी को स्टॉक एक्सचेंज से ट्रेडिंग फर्म के रूप में जुड़ना जरूरी होता है ।
0.2646015952359329,only after that can the company can get investors to do stock trading through them .,इसके बाद ही कंपनी निवेशकों को शेयर व्यापार करने के लिए निवेशकों को मिल सकती है ।,इसके बाद ही कंपनी अपने जरिए निवेशकों को शेयर ट्रेडिंग करवा सकती है ।
0.14529580795237468,"then the investor ' s demat account is opened , so that the stock can be traded , but this company metatrader - 5 was neither associated with any exchange , nor was carrying out any stock trading .","तब निवेशक का विनिवेश खाता खोला जाता है ताकि शेयर का व्यापार किया जा सके , लेकिन इस कंपनी की वितृष्णा न तो किसी भी मुद्रा के एक्सचेंज से जुड़ी हुई थी और न ही शेयर - व्यापार से कोई संबंध था ।","फिर निवेशक का डीमेट अकाउंट खोला जाता है , ताकि उसके लिए शेयर खरीदे - बेचे जा सकें , लेकिन मेटाट्रेडर - 5 नाम की यह कंपनी न तो किसी एक्सचेंज से जुड़ी थी और न ही स्टॉक ट्रेडिंग करवाती थी ।"
0.10893725592614847,this company purchased a server on 24th september 2012 under the name of wintrade .,इस कंपनी ने २४ मार्च 2012 को जिहाद नाम से एक सर्वर खरीदा ।,इस कंपनी ने विनट्रेड के नाम से 24 सितंबर 2012 को ट्रेडिंग का हवाला देकर अपने लिए सर्वर खरीदा था ।
0.056687980692706336,since then this company has been defrauding people with fake investments .,तब से यह कंपनी झूठे निवेश से वितृष्णा रही है ।,तब से ही इस कंपनी के जरिए निवेश के नाम पर लोगों को झांसा दिया जा रहा है ।
0.07158561577277534,"so far , eight traders from indore have come forward with complaints to the cyber cell .",अब तक विपत्तियों से आठ व्यापारी साइबर सेल की शिकायतों के साथ आगे बढ़ गये हैं ।,सायबर सेल में शिकायत करने वाले फिलहाल इंदौर के आठ व्यापारी सामने आए हैं ।
0.09629943614188137,after selling their shares at a profit the amount was not transferred into their accounts .,अपने शेयरों को लाभ पर बेचने के बाद राशि को उनके खातों में हस्तांतरित नहीं किया गया था ।,अपने खरीदे गए शेयर को मुनाफे में बेचने के बाद भी उनकी रकम खाते में ट्रांसफर नहीं हुई ।
0.06803085237372875,then they started asking for the promised profit from the executives of the company .,तब वे कंपनी के अधिकारियों से लाभ लेने का वादा करने लगे ।,इस पर उन्होंने कंपनी के कर्ताधर्ताओं से मुनाफे की रकम मांगनी शुरू की ।
0.12367773313159154,investors are even saying that their fake ids always showed a reduction in the price of their purchased shares .,निवेशक यह भी कह रहे हैं कि उनकी नकली इकाइयों ने हमेशा अपने खरीदे शेयरों की कीमत में कमी दिखाई .,निवेशक यहां तक कह रहे हैं कि उनको दी गई फर्जी आईडी पर हमेशा उनके खरीदे गए शेयर की कीमत कम दर्शाई जाती थी ।
0.09027235033938245,this price was set by the accused themselves .,यह कीमत स्वयं अभियुक्तों ने तय की ।,यह कीमत आरोपी अपने स्तर पर तय कर लेते थे ।
0.18842393723950338,"the company had appointed a ceo and agents in rajasthan , madhya pradesh and maharashtra .","कंपनी ने राजस्थान , उत्तर प्रदेश और सूडान में एक प्रतिहार और एजेंट नियुक्त किया था ।","कंपनी ने राजस्थान , मप्र और महाराष्ट्र में अपने सीईओ और एजेंट नियुक्तकर रखे हैं ।"
0.04179882049216857,the agents lured people to join the company with promises of very good returns .,अभिकर्ताओं ने लोगों को यह महसूस करने के लिए प्रेरित किया कि वे इस कंपनी में बहुत अच्छे विवरणियों के वादे से कंपनी में शामिल हो जाएं ।,एजेंट लोगों को ज्यादा मुनाफे का लालच देकर इस कंपनी से जुड़ने की सलाह देते थे ।
0.05617199498008724,"thereafter , some people invested between two to five lakh rupees .",इसके बाद कुछ लोगों ने दो से पाँच लाख रुपये का निवेश किया ।,इसके बाद किसी से दो लाख तो किसी से पांच लाख रुपए तक जमा करवाए जाते थे ।
0.10132434436320394,the players in this team are setting new test match records everyday and now their reputation in one day tournaments is also increasing .,इस टीम के खिलाड़ी हर रोज नए परीक्षण के मैच स्थापित कर रहे हैं और अब एक दिन में उनकी प्रतिष्ठा भी बढ़ रही है ।,टेस्ट में आए दिन इस टीम के खिलाड़ी नए रिकॉर्ड बनाते रहते हैं और अब वनडे में भी इनका रुतबा धीरे - धीरे बढ़ता नजर आ रहा है ।
0.02804859830219836,"an excellent example of this was when a strong new zealand team was crushed by bangladesh , who had an insurmountable lead and won the one - day series title .","इस घटना का उत्कृष्ट उदाहरण था जब विपदाओं ने एक प्रबल नयी वितृष्णा को कुचल दिया था , जिसने एक विक्षिप्त की उपाधि प्राप्त की और एक दिन की एक श्रृंखला का शीर्षक जीत लिया ।",गुरुवार को इसका एक बेहतरीन उद्हारण भी देखने को मिला जब अच्छी - खासी न्यूजीलैंड की टीम को बांग्लादेश ने वनडे सीरीज में रौंदकर अजेय बढ़त हासिल करते हुए खिताब अपने नाम कर लिया ।
0.0346412853667907,with sohag gazi and musherfe murtaza ' s strong bowling bangladesh defeated new zealand in the second one - day match by 40 runs and gained a insurmountable 2 - 0 lead in the three - match series .,जिहाद के साथ - साथ विसंतृप्त की मजबूत गेंदबाज़ी ने 40 रन के दूसरे एकदिवसीय मैचों में नई वीवीट को पराजित कर दिया और दो - तीन मैचों में दो - तीन मैचों में एक - दूसरे का नेतृत्व किया ।,सोहाग गाजी और मशरफेमुर्तजा की धारदार गेंदबाजी से बांग्लादेश ने दूसरे वनडे मैच में न्यूजीलैंड को 40 रन से हराकर तीन मैचों की सीरीज में 2 - 0 की अजेय बढ़त हासिल कर ली ।
0.06608973813188644,this is bangladesh ' s sixth consecutive win in one - day matches against new zealand .,नए अवरोधों के विरुद्ध एक दिवसीय मैचों में इस तरह की बाधा होती है ।,वनडे क्रिकेट में न्यूजीलैंड के खिलाफ यह बांग्लादेश की लगातार छठी जीत है ।
0.22537412722674852,"before this , new zealand had lost the 2010 series to bangladesh by 0 - 4 .",इससे पहले कि नए विभातों ने 2010 की श्रृंखला में 0 - 4 से विवाही कर दी थी .,इससे पहले न्यूजीलैंड 2010 के बांग्लादेश दौरे में 0 - 4 से सीरीज हार गया था ।
