bleu,x,y,z
0.3073940764756322,a black box in your car ?,आपके कार में एक ब्लैक बॉक्स ?,आपकी कार में ब्लैक बॉक्स ?
0.018196044377942644,"as america ' s road planners struggle to find the cash to mend a crumbling highway system , many are beginning to see a solution in a little black box that fits neatly by the dashboard of your car .",अपनी कार की जड़ियों से बचने के लिए एक छोटे से काले बक्से में एक समाधान देखने शुरू कर रहे हैं ।,"जबकि अमेरिका के सड़क योजनाकार , ध्वस्त होते हुए हाईवे सिस्टम को सुधारने के लिए धन की कमी से जूझ रहे हैं , वहीं बहुत - से लोग इसका समाधान छोटे से ब्लैक बॉक्स में देख रहे हैं , जो आपकी कार के डैशबोर्ड पर सफ़ाई से फिट हो जाता है ।"
0.06324480382326664,"the devices , which track every mile a motorist drives and transmit that information to bureaucrats , are at the center of a controversial attempt in washington and state planning offices to overhaul the outdated system for funding america ' s major roads .","डिवाइस , जो हर मील एक दूसरे मील की दूरी पर चलते हैं और उन सूचनाओं को संप्रेषित करते हैं , जो विक्षोभ के लिए सूचना को संप्रेषित करते हैं , एक विवादास्पद प्रयास के केंद्र में हैं , जो कि पुरानी व्यवस्था को नष्ट करने के लिए निराशाजनक प्रयास के केंद्र में है .","यह डिवाइस , जो मोटर - चालक द्वारा वाहन चलाए गए प्रत्येक मील को ट्रैक करती है तथा उस सूचना को अधिकारियों को संचारित करती है , आजकल अमेरिका की प्रमुख सड़कों का वित्त - पोषण करने के लिए पुराने हो चुके सिस्टम का जीर्णोद्धार करने के लिए वाशिंगटन और राज्य नियोजन कार्यालय के लिए एक विवादास्पद प्रयास का मुद्दा बन चुका है ।"
0.04255541381996154,the usually dull arena of highway planning has suddenly spawned intense debate and colorful alliances .,राजमार्ग नियोजन के क्षेत्र में अक्सर इस क्षेत्र में बहुत कम बहस की जाती है ।,आम तौर पर हाईवे नियोजन जैसा उबाऊ काम भी अचानक गहन बहस तथा जीवंत गठबंधनों का मुद्दा बन गया है ।
0.09268234863027174,"libertarians have joined environmental groups in lobbying to allow government to use the little boxes to keep track of the miles you drive , and possibly where you drive them - then use the information to draw up a tax bill .",जिहाद ने जिहाद में पर्यावरण समूहों को भी शामिल कर लिया है ताकि सरकार को अपने पास की दूरी का ट्रैक रखने के लिए छोटे बक्से का उपयोग करने की अनुमति दे दें और संभव है कि आप उन सूचनाओं का इस्तेमाल कर लें जो आप उन्हें चलाते हैं ।,"आपने द्वारा ड्राइव किए गए मील , तथा संभवतः ड्राइव किए गए स्थान का विवरण रखने - और फिर इस सूचना का उपयोग टैक्स बिल तैयार करने के लिए - सरकार को इन ब्लैक बॉक्स का उपयोग करने की अनुमति देने के पक्ष में समर्थन जुटाने के लिए लिबरेटेरियन पर्यावरणीय समूहों के साथ मिल गए हैं ।"
0.25406637407730737,the tea party is aghast .,चाय की पार्टी है ।,चाय पार्टी भौचक्की है ।
0.12111821080874724,"the american civil liberties union is deeply concerned , too , raising a variety of privacy issues .",स्वतंत्रता के लिए नागरिक स्वतंत्रता संघ का बहुत सरोकार है ।,अमेरिकी नागरिक स्वतंत्रता संघ भी विभिन्न प्रकार के गोपनीयता मुद्दे उठाते हुए बहुत चिंतित है ।
0.1403971249528161,"and while congress can ' t agree on whether to proceed , several states are not waiting .",और जब कांग्रेस आगे बढ़ने के बारे में सहमत नहीं हो सकती तो कई राज्य प्रतीक्षा नहीं कर सकते ।,"जबकि कांग्रेस इस बात पर सहमत नहीं हो सकी कि आगे की कार्यवाही करनी है या नहीं , बहुत से राज्य प्रतीक्षा नहीं कर रहे ।"
0.32668878427413106,"they are exploring how , over the next decade , they can move to a system in which drivers pay per mile of road they roll over .",वे यह खोज कर रहे हैं कि अगले दशक में वे एक ऐसी व्यवस्था की ओर ले जा सकते हैं जिस पर ड्राईवर चलाते हैं ।,"वे यह खोज कर रहे हैं कि अगले दशक में वे किस तरह से ऐसी प्रणाली में जा सकते हैं , जिसमें चालक सड़क पर तय किए गए प्रत्येक मील के लिए भुगतान करे ।"
0.12247917878726056,"thousands of motorists have already taken the black boxes , some of which have gps monitoring , for a test drive .","हजारों भनें पहले ही काले बक्से ले चुकी हैं , जिनमें से कुछ को एक टेस्ट ड्राइव के लिए अनुवीक्षण की निगरानी है ।","हजारों मोटर - चालकों ने टेस्ट ड्राइव के लिए पहले ही ब्लैक बॉक्स ले लिया है , जिसमें से कुछ में जी . पी . एस . मॉनीटरिंग है ।"
0.13950796967929135,this really is a must for our nation .,यह वास्तव में हमारे राष्ट्र के लिए एक जरूरी है ।,यह हमारे देश के लिए वास्तव में अनिवार्य वस्तु है ।
0.09077155296696018,""" it is not a matter of something we might choose to do , "" said hasan ikhrata , executive director of the southern california assn . of governments , which is planning for the state to start tracking miles driven by every california motorist by 2025 .","' ' यह कोई बात नहीं है कि हम ऐसा करने के लिए चुन लें , "" ' भारत सरकारों की विभरता , कार्यकारिणी - निदेशक , जो राज्य की योजना बनाने की योजना बना रही है , वह है , जो राज्य की योजना बनाने की योजना बना रहा है .",""" यह हमारे द्वारा चुने या नहीं चुने जाने का विषय नहीं है "" यह कहना है हसन इखराता का जो दक्षिण कैलीफोर्निया सरकार संघ के कार्यकारी निदेशक हैं , जो वर्ष 2025 तक कैलीफोर्निया में मोटर - चालकों द्वारा तय किए गए प्रत्येक मील को ट्रैक करने की शुरुआत करने की योजना बना रहा है ।"
0.41374412020518814,there is going to be a change in how we pay these taxes .,हम इन करों का भुगतान कैसे करते हैं में परिवर्तन होने जा रहा है ।,हमारे द्वारा कर भुगतान किए जाने के तरीके में परिवर्तन होने जा रहा है ।
0.3073940764756322,the technology is there to do it .,तकनीक यह करने के लिए है ।,ऐसा करने के लिए प्रौद्योगिकी है ।
0.04877109037498037,"the push comes as the country ' s highway trust fund , financed with taxes americans pay at the gas pump , is broke .",इस धक्के को देश की हाइवल ट्रस्ट निधि के रूप में देखते हैं जो गैस पम्प पर अदा की गई वितृष्णा से वित्त पोषित है ।,"ऐसा होने का मुख्य कारण यह है कि देश का हाईवे ट्रस्ट फ़ंड लगभग दिवालिया हो गया है , जिसका वित्त - पोषण अमेरिकी नागरिकों द्वारा गैस पम्प पर किए जाने वाले करों के भुगतान से होता है ।"
0.04065425428798724,americans don ' t buy as much gas as they used to .,लालच उतनी गैस की तरह नहीं खरीदना चाहिए जितना वे करते थे ।,अमेरिकी लोग अब पहले जितनी गैस नहीं खरीदते ।
0.04112362514034741,cars get many more miles to the gallon .,कार बहुत ज्यादा मील की दूरी तक ले जाती है .,अब एक गैलन गैस में कार पहले से अधिक मील चलती है ।
0.08144648632244794,"the federal tax itself , 18 . 4 cents per gallon , hasn ' t gone up in 20 years .","संघीय कर भी है , प्रति गैलन 18 . 4 गैलन .","फेडरल टैक्स में पिछले 20 वर्षों में कोई बढ़ोतरी नहीं हुई , जो 18 . 4 सेंट प्रति गैलन है ।"
0.027178901196360062,politicians are loath to raise the tax even one penny when gas prices are high .,यदि गैस की कीमतें अधिक होती हैं तो कर को भी एक सिक्का तक उठाना होता है .,गैस के उच्च मूल्य होने के कारण राजनेता टैक्स में एक पैसा भी वृद्धि करने से परहेज करते हैं ।
0.0975568416121392,""" the gas tax is just not sustainable , "" said lee munnich , a transportation policy expert at the university of minnesota .",""" गैस कर स्थायी नहीं है , "" कहा जा सकता है कि ' ' विनीत विश्वविद्यालय में विशेषज्ञ की नीति ' ' है .","मिनेसोटा विश्वविद्यालय में परिवहन नीति विशेषज्ञ ली मुनिख कहते हैं , "" गैस कर बिल्कुल संवहनीय नहीं है । """
0.12175790049611575,his state recently put tracking devices on 500 cars to test out a pay - by - mile system .,हाल ही में उनकी स्थिति में 500 कारों पर ट्रैकिंग करने वाली युक्तियों की जांच की गई है ताकि वे एक मासिक प्रणाली का परीक्षण कर सकें .,उनके राज्य ने प्रति - मील भुगतान प्रणाली का परीक्षण करने के लिए हाल ही में 500 कारों में ट्रैकिंग डिवाइस लगाई है ।
0.2049648954309337,""" this works out as the most logical alternative over the long term , "" he said .",यह कहा गया है कि यह दीर्घकालिक विकल्प के रूप में काम करता है ।,"वे कहते हैं , "" दीर्घकाल में यह सबसे अधिक तर्कपूर्ण विकल्प के रूप में काम करेगा । """
0.09442944296079735,wonks call it a mileage - based user fee .,इसे एक माईलेज आधारित उपयोगकर्ता फीस फोन करें .,वॉन्क्स इसे माइलेज - आधारित उपयोगकर्ता शुल्क कहते हैं ।
0.12716230509797075,"it is no surprise that the idea appeals to urban liberals , as the taxes could be rigged to change driving patterns in ways that could help reduce congestion and greenhouse gases , for example .","यह कोई आश्चर्य की बात नहीं है कि इस विचार से शहरी उदारवादियों को अपील की जा सकती है , क्योंकि कर - चाल में बदलाव लाने में मदद की जा सकती है ।","यह आश्चर्य की बात नहीं है कि यह विचार शहरी उदारवादियों को अच्छा लग रहा है , क्योंकि इससे , उदाहरण के लिए कार चलाने के तौर - तरीके में परिवर्तन करने के लिए करों में बदलाव किया जा सकता है , जो जाम कम करने तथा ग्रीनहाउस गैस कम करने में सहायता कर सकता है ।"
0.08613820208524364,california planners are looking to the system as they devise strategies to meet the goals laid out in the state ' s ambitious global warming laws .,इस प्रणाली की खोज की जा रही है क्योंकि वे राज्य की महत्वाकांक्षी ग्लोबल वार्मिंग कानून में निर्धारित लक्ष्यों को पूरा करने के लिए नीतियां बनाते हैं ।,कैलीफोर्निया के योजनाकार इस सिस्टम के लिए उत्सुक हैं जबकि वे राज्य के महात्वाकांक्षी ग्लोबल वार्मिंग कानूनों में निर्धारित लक्ष्य पूर्ण करने के लिए रणनीतियाँ विकसित कर रहे हैं ।
0.16684244069652804,"but rep . bill shuster ( r - pa . ) , chairman of the house transportation committee , has said he , too , sees it as the most viable long - term alternative .",लेकिन गृह परिवहन समिति के अध्यक्ष ने भी यह कहा है कि गृह परिवहन समिति के अध्यक्ष ने भी इसे सर्वाधिक व्यवहार्य विकल्प माना है ।,"लेकिन गृह परिवहन समिति के अध्यक्ष , रिप . बिल शुस्टर ( आ . - पी . ए . ) भी ब्लैक बॉक्स को सबसे व्यवहार्य दीर्घकालिक विकल्प मानते हैं ।"
0.06839596061560943,the free marketeers at the reason foundation are also fond of having drivers pay per mile .,"इस कारण , इस आधार पर एक मील प्रति मील की कीमत वाले ड्राइवर भी हैं ।",रीजन फ़ाउंडेशन में स्वतंत्र विक्रेता भी चालक द्वारा प्रति मील भुगतान के पक्ष में हैं ।
0.17376436413676966,""" this is not just a tax going into a black hole , "" said adrian moore , vice president of policy at reason .",""" यह सिर्फ एक कर नहीं है एक ब्लैक होल में जा रहा है , "" ने तर्क पर नीति के उपाध्यक्ष के रूप में कहा .","रीजन में पॉलिसी के उपाध्यक्ष , एड्रियन मूर ने कहा , "" यह मात्र ऐसा कर नहीं है जो अंधे कुएँ में जा रहा है । """
0.15377854660688903,people are paying more directly into what they are getting .,लोगों को अधिक सीधे भुगतान कर रहे हैं ।,"लोग जो चीज प्राप्त कर रहे हैं , उसके लिए अधिक प्रत्यक्ष रूप से भुगतान कर रहे हैं ।"
0.041217111204696705,"the movement is also bolstered by two former u . s . transportation secretaries , who in a 2011 report urged congress to move in the pay - per - mile direction .","इस आंदोलन में दो भूतपूर्व भारतीय परिवहन सचिव भी हैं , जिन्होंने कांग्रेस से अनुरोध किया है कि वे कांग्रेस की ओर से भुगतान करें ।","इस अभियान को दो भूतपूर्व अमेरिकी परिवहन सचिवों ने भी समर्थन दिया है , जिन्होंने वर्ष 2011 में अपनी रिपोर्ट में कांग्रेस से प्रति - मील भुगतान की दिशा में आगे बढ़ने का अनुग्रह किया था ।"
0.2026486887264079,"the u . s . senate approved a $ 90 - million pilot project last year that would have involved about 10 , 000 cars .","उ . एस . ने पिछले साल एक $ 90 लाख पायलट परियोजना मंजूर की है , जिसमें करीब 10 , 000 कारें शामिल होंगी .","यू . एस . सीनेट ने पिछले वर्ष 90 - मिलियन डॉलर की परीक्षण परियोजना स्वीकृत की थी , जिसमें 10 , 000 कारें शामिल हो गई होतीं ।"
0.04108736977639772,"but the house leadership killed the proposal , acting on concerns of rural lawmakers representing constituents whose daily lives often involve logging lots of miles to get to work or into town .","लेकिन गृह नेतृत्व ने प्रस्ताव को नष्ट कर दिया , जो उन घटकों का प्रतिनिधित्व करती है , जिनके दैनिक जीवन को अक्सर काम करने या शहर में पहुंचने के लिए कई मील की ग्रामीण रियायत की चिंता होती है ।","लेकिन ग्रामीण विधि - निर्माताओं की चिंताओं पर काम करते हुए , जो ऐसे व्यक्तियों का प्रतिनिधि कर रहे थे जिन्हें रोजाना काम पर जाने अथवा शहर में जाने के लिए बहुत अधिक मील चलना पड़ता है , सदन के नेतृत्व ने उस प्रस्ताव को वहीं पर समाप्त कर दिया ।"
0.33755544000898147,several states and cities are nonetheless moving ahead on their own .,बहुत से राज्य और शहर अपने आप से आगे बढ़ रहे हैं ।,फिर भी बहुत से राज्य और शहर खुद - ब - खुद इस दिशा में आगे बढ़ रहे हैं ।
0.2186597437352254,"the most eager is oregon , which is enlisting 5 , 000 drivers in the country ' s biggest experiment .",सबसे ज्यादा सुविधापूर्ण है जो देश के सबसे बड़े प्रयोग में सहायक है ।,"इसमें सबसे अधिक इच्छुक ऑरेगोन है , जिसने देश के सबसे बड़े प्रयोग में 5 , 000 चालक सूचीबद्ध किए हैं ।"
0.195647514979229,those drivers will soon pay the mileage fees instead of gas taxes to the state .,ये ड्राइवर राज्य में गैस कर के बजाय किलेज की फीस का भुगतान कर देंगे .,ये चालक जल्द ही राज्य को गैस कर के बजाय माइलेज शुल्क का भुगतान करेंगे ।
0.07635362674858093,nevada has already completed a pilot .,मजबूरी में एक पायलट पूरा हो चुका है ।,नेवाडा ने पहले ही प्रारंभिक परीक्षण पूर्ण कर लिया है ।
0.0711586419732111,new york city is looking into one .,नयी वितृष्णा का शहर एक है ।,न्यू यॉर्क शहर भी इस दिशा में आगे बढ़ रहा है ।
0.06250381527944884,illinois is trying it on a limited basis with trucks .,वितृष्णा इस बात की कोशिश कर रही है कि वह ट्रकों से बनी है ।,इलिनोइस सीमित आधार पर ट्रकों के साथ आज़माइश कर रहा है ।
