bleu,x,y,z
0.04181934707172611,"the announcement came as fighting raged thursday in the town of safira , which experts say is home to a chemical weapons production facility as well as storage sites , reported the britain - based syrian observatory for human rights .","इस घोषणा की घोषणा की गयी , जिससे विशेषज्ञ इस बात की घोषणा कर रहे थे कि एक रासायनिक हथियार उत्पादन सुविधा के साथ - साथ भंडारण स्थलों के लिए विविवाही आधारित विभेष का विवरण भी दिया गया है ।","ब्रिटेन स्थिति सीरियन ऑब्जर्वेटरी फॉर ह्यूमन राइट्स ने रिपोर्ट दी है कि यह घोषणा उस समय हुई जब गुरुवार को सफीरा शहर में संघर्ष में वृद्धि हुई , जिसके बारे में विशेषज्ञों का मानना है कि यह रासायनिक हथियार उत्पादन इकाई के और साथ ही संग्रहण केन्द्र है ।"
0.2638548135474381,"the activist group , which has been tracking the death toll through a network of activists in syria , said thursday that 120 , 296 people have died .","सक्रिय दल , जो कार्यकर्ताओं के एक नेटवर्क के माध्यम से मौत की मार को ट्रैक कर रहा है , ने कहा कि 120 , विमोचन लोगों की मृत्यु हो चुकी है .","सीरिया में आंदोलन के नेटवर्क के माध्यम से मृतकों की संख्या का विवरण रखने वाले आंदोलन समूह ने गुरुवार को कहा कि 120 , 296 लोगों की मृत्यु हो चुकी हैं ।"
0.05546271694289608,"of those , it said 61 , 067 are civilians , including 6 , 365 children .","उन लोगों की , यह 61 ने कहा , 6 , reresled बच्चों सहित नागरिक ।","उसने कहा है कि इसमें से 6 , 365 बच्चे समेत 61 , 067 आम नागरिक शामिल हैं ।"
0.18201017581749604,"on the government side , it said 29 , 954 are members of president bashar assad ' s armed forces , 18 , 678 are pro - government fighters and 187 are lebanese hezbollah militants .","सरकार की ओर से यह 29 ने कहा कि राष्ट्रपति जी की सेनाओं के सदस्य राष्ट्रपति विक्रेट की सशस्त्र सेनाओं के सदस्य हैं , 18 मार्च को सरकार के नेताओं के समर्थक हैं और उनमें शत्रुता है .","सरकार की ओर से कहा गया है कि 29 , 954 राष्ट्रपति बशर असद की सैन्य सेना के सदस्य हैं , 18 , 678 सरकार के पक्ष में लड़ने वाले लड़ाकू हैं तथा 187 लेबनीज हिजबुल्लाह उग्रवादी हैं ।"
0.04033952336952125,"also among the dead it said were 2 , 202 army defectors and some 5 , 375 opposition fighters , many of them foreigners .","मृतकों के बीच भी यह कहा जा सकता है कि 2 , 2 , 2 , 2 , 2 , विवार सैनिक , कई विदेशी थे ।","इसने यह भी कहा कि मृतकों में 2 , 202 सेना के भगोड़े तथा लगभग 5 , 375 विपक्षी लड़ाकू हैं , जिसमें से बहुत से विदेशी हैं ।"
0.07280210025705969,"on july 25 , the u . n . estimated 100 , 000 have died in the conflict since march 2011 .","सन् 2011 के बाद से मार्च , 2011 से इस संघर्ष में 100 , 000 रु . का अनुमान लगाया गया है .","25 जुलाई को यू . एन . ने अनुमान व्यक्त किया कि मार्च 2011 से चले आ रहे संघर्ष में लगभग 100 , 000 लोगों की मृत्यु हो चुकी है ।"
0.06413885305524152,it has not updated that figure since .,यह अद्यतन कि से आंकड़ा नहीं है ।,इसने तब से आंकड़ों को अपडेट नहीं किया ।
0.06722636787666482,the conflict has forced some 2 million people to flee the country .,इस संघर्ष ने करीब 2 लाख लोगों को देश से भागने के लिए मजबूर कर दिया है .,इस संघर्ष के कारण लगभग 20 लाख लोग देश छोड़ने के लिए मज़बूर हुए हैं ।
0.070771878626193,"assad ' s troops have been battling rebels , many of them linked to al - qaida groups , in safira for weeks .","तपस्विनी की सेनाओं में से बहुत से लोग अछूत होते रहे हैं , जिनमें से बहुतों ने विवाह - विराम में कई - कई गुटों से जुड़े हुए हैं ।","असद का सैन्य दल सफीरा में कई सप्ताह तक विद्रोहियों से युद्ध करता रहा , जिनमें से कई लोग अल - कायदा समूहों से सम्बन्धित थे ।"
0.17140491696035876,the observatory said there were casualties on both sides thursday but had no specifics .,"इन दोनों पक्षों ने कहा कि दोनों पक्षों पर हताहत हो गए हैं , लेकिन इसमें कोई झिझक नहीं है ।","गुरुवार को ऑब्जर्वेटरी ने कहा कि दोनों ओर से लोग हताहत हुए हैं , लेकिन स्पष्ट रूप से कुछ नहीं कहा ।"
0.05289855073152944,the fighting underscored the dangers the chemical weapons ' inspectors face as they race against tight deadlines in their mission to rid syria of the toxic arsenal in the midst of an ongoing civil war .,"एक चल रहे नागरिक युद्ध के दौरान जो विषाक्त अस्पृश्यों की बहुलता को दूर करने के लिए वे अपने उद्देश्य में संकीर्ण सेवकों के खिलाफ संघर्ष करने की होड़ में हैं , उन खतरों को रोकने के लिए संघर्ष करने की होड़ में है ।","यह युद्ध , रासायनिक हथियारों के निरीक्षकों द्वारा सामना किए जाने वाले खतरे को दर्शाता है , जिनके पास बहुत कम समय - सीमा में , चल रहे गृह युद्ध के दौरान सीरिया में विषाक्त हथियार समाप्त करने का मिशन है ।"
0.07754964741688533,"a statement from the opcw , which works closely with the united nations , said its team was "" now satisfied that it has verified - and seen destroyed - all of syria ' s declared critical production and mixing / filling equipment . ""","एक वक्तव्य जो संयुक्त राष्ट्र के साथ घनिष्ठ रूप से काम करता है , जो संयुक्त राष्ट्र के साथ घनिष्ठ रूप से काम करता है , इस समय से संतुष्ट होता है कि इसने अपने दल को प्रमाणित किया है और उसकी पुष्टि की है और उसे भरने / भरने का उपकरण है । ""","संयुक्त राष्ट्र के साथ मिलकर काम करने वाले ओ . पी . सी . डब्लू . की ओर बयान में कहा गया कि इसका दल "" अभी संतुष्ट है तथा इसने पुष्टि कर ली है - तथा सीरिया के सभी घोषित महत्वपूर्ण उत्पादन और मिश्रण / भरने वाले उपकरणों को - नष्ट रूप में देख लिया है । """
0.03374807729923191,"it added that , "" no further inspection activities are currently planned . ""","यह जोड़ा गया है कि "" अब कोई और निरीक्षण कार्य नहीं किया गया है . ""","इसने यह भी कहा , "" आगे कोई निरीक्षण गतिविधि की योजना नहीं बनाई जा रही । """
0.1450195841014254,"earlier this week , the inspectors said they had completed their first round of verification work , visiting 21 of 23 sites declared by damascus .","इस सप्ताह के शुरू में , निरीक्षकों ने कहा कि उन्होंने अपना पहला सत्यापन कार्य पूरा कर लिया है , जो कि अछूतों द्वारा घोषित 23 साइटों का 21 है ।",इस सप्ताह के आरंभ में निरीक्षकों ने कहा था कि उन्होंने डमस्कस द्वारा घोषित 23 केन्द्रों में से 21 केन्द्रों पर जाकर पुष्टि कार्य का प्रथम चरण पूर्ण कर लिया है ।
0.06270144942040143,"they were unable to visit two sites because of security concerns , the inspectors said .",सुरक्षा की चिंताओं के कारण वे दो स्थानों पर जा नहीं पाए थे ।,निरीक्षकों ने कहा कि वे सुरक्षा कारणों से दो केन्द्रों पर जाने में सक्षम नहीं थे ।
0.028486297122258,"on thursday , opcw said the two locations were , according to syria , "" abandoned and . . . the chemical weapons program items they contained were moved to other declared sites , which were inspected . ""","निर्लज्धता के बारे में कहा गया है कि ये दोनों स्थान विखंडित , "" त्याग "" और रासायनिक हथियारों के कार्यक्रम के अनुसार अन्य घोषित स्थलों पर भेजे गए थे ।","शुक्रवार को ओ . पी . सी . डब्लू . ने कहा कि सीरिया के अनुसार ये दो केन्द्र "" त्याग दिए गए हैं तथा . . . वहां रखी गई रासायनिक हथियार उत्पाद वस्तुओं को अन्य घोषित केन्द्रों पर पहुंचा दिया गया था , जिसका निरीक्षण कर लिया गया है । """
0.13181177567484484,it was not immediately clear if the facility in safira was one of the two sites that opcw inspectors were not able to visit .,"यह तुरंत स्पष्ट नहीं हुआ कि यदि निरीक्षकों की ऐसी दो बातों में से एक है , जो निरीक्षकों में नहीं जा सकते ।","यह तत्काल स्पष्ट नहीं हुआ कि सफीरा में इकाई , उन दो केन्द्रों में से एक है या नहीं , जहां ओ . पी . सी . डब्लू . के निरीक्षक जाने में सक्षम नहीं थे ।"
0.034671395901174476,syria has submitted a plan for the total destruction of its chemical weapons that has to be approved next month by the opcw ' s executive committee .,इस प्रकार की एक योजना में दमनकारी की कार्यकारिणी - समिति द्वारा अगले महीने की मंजूरी दी गई है ।,"सीरिया ने अपने रासायनिक हथियारों के सम्पूर्ण विनाश के लिए योजना प्रस्तुत की है , जिसे अगले महीने ओ . पी . सी . डब्लू . की कार्यकारी समिति द्वारा स्वीकृत किया जाना है ।"
0.07064064625976392,""" i salute the fortitude and courage you ' ve all demonstrated in fulfilling the most challenging mission ever undertaken by this organization , "" the watchdog ' s director - general , ahmet uzumcu , said in comments released by the opcw .","' ' इस संगठन द्वारा किए गए सर्वाधिक चुनौतीपूर्ण मिशन को पूरा करने में आप सभी ने जो साहस और साहस व्यक्त किया है , वह इस बात का प्रतीक है कि इस संगठन द्वारा दिए गए सर्वाधिक चुनौतीपूर्ण लक्ष्य को पूरा करने में आप सभी ने इस बात का संकेत दिया है .","ओ . पी . सी . डब्लू . द्वारा जारी टिप्पणी में निगरानी करने वाले समूह के महानिदेशक अहमट उजुम्कु ने कहा , "" इस संगठन द्वारा अब तक किए गए सबसे चुनौतीपूर्ण मिशन को पूर्ण करने में आप लोगों द्वारा प्रदर्शित की गई दृढ़ता तथा हौसले को मैं सलाम करता हूँ । """
0.032774621955701064,"now in its third year , the civil war pits the primarily sunni muslim rebels against assad ' s government and its security forces , which are stacked with members of his alawite sect , an offshoot of shiite islam .","अब अपने तीसरे वर्ष में , नागरिक युद्ध के रूप में सरकार की सुरक्षा और उसकी सुरक्षा सेनाओं के खिलाफ मुस्लिम युद्ध का मुख्य रूप से मुस्लिम विद्रोह होता है , जो अपने द्विसंप्रदाय के सदस्यों से फासिस्टवाद की शाखा है ।","तीन वर्षों से चला आ रहा यह गृह युद्ध मुख्यः रूप से असद की सरकार तथा उसके सुरक्षा बलों , जिसमें शिया इस्लाम के से निकले , अलावाइट पंथ के सदस्य शामिल हैं , तथा विद्रोही सुन्नी मुस्लिमों के बीच का संघर्ष है ।"
0.1071006312348702,"in other developments , the observatory ' s chief rami abdurrahman said there had been a strong explosion wednesday inside an air defense facility in syria ' s coastal province of latakia .","दूसरी घटनाओं में , जिहाद की प्रमुख घोषणाएँ ने कहा था कि दमनकारी के तटीय क्षेत्र में हवाई प्रतिरक्षा की सुविधा के भीतर एक जोरदार विस्फोट हुआ है ।",अन्य घटनाक्रम में आब्जर्वेटरी के प्रमुख रामी अब्दुर्रहमान ने कहा कि सीरिया के तटीय क्षेत्र लताकिया में एयर डिफेन्स केन्द्र में बुधवार को जोरदार विस्फोट हुआ था ।
0.1749165062636126,"the cause of the blast was not known , he said .","विस्फोट का कारण ज्ञात नहीं था , उसने कहा ।",उन्होंने कहा कि इस विस्फोट का कारण अभी ज्ञात नहीं है ।
0.09277924325130706,"police seized a forged registry , forged seals , a laptop and photocopies of registration documents from the accused .","पुलिस ने एक गढ़ा हुआ रजिस्ट्री , गढ़ा हुआ मुहर , लैपटॉप और उन दस्तावेजों का पंजीकरण किया ।","पुलिस ने आरोपियों के कब्जे से जाली रजिस्ट्री , जाली मुहरें , लैपटॉप और जाली रजिस्ट्री की फोटो कॉपियां बरामद की हैं ।"
0.06217116757317284,moti nagar police have registered a case against the accused .,इन अभियुक्तों के खिलाफ एक मुकदमा चलाया गया है ।,मोती नगर पुलिस ने सभी आरोपियों पर मामला दर्ज कर लिया है ।
0.01637144480369675,"police commissioner paramjit singh said that those arrested and accused are haiboval rajiv agarwal a . k . a . bintu from chandan nagar , from ghumar mandi , kamal krushna jaiswal , gurwinder singh jaggi from kohada and sonu from ghumar mandi .",पुलिस आयुक्त ने कहा कि वे गिरफ्तार किये गये और अभियुक़्त हैं और उन्हें गिरफ्तार करते हैं ।,"पुलिस कमिश्नर परमजीत सिंह गिल ने बताया कि गिरफ्तार आरोपियों में हैबोवल स्थित चंद्र नगर का राजीव अग्रवाल उर्फ बिंट्टू , घुमार मंडी का कमल कृष्ण जसवाल , कोहाड़ा का गुरिंदर सिंह गग्गी और घुमार मंडी का सोनू शामिल हैं ।"
0.06917184228205472,balbir singh from the registrar office ( east ) has fled from the scene .,विमर्य ( पूर्व में ) विरक्त सिंह ने इस स्थान से भाग लिया है ।,रजिस्ट्रार दफ्तर ( पूर्वी ) का बलबीर सिंह मौके से फरार हो गया है ।
0.0229696772946306,"according to the police the accused used to take out the documents of the records of vacant and old plots with the help of balbir singh , a clerk and record keeper in the registrar office and then , by purchasing new stamp papers , used to make counterfeit registration documents for them .",पुलिस के अनुसार अभियुक्तों ने खाली और पुराने भूखंड के अभिलेखों के दस्तावेजों का दस्तावेज निकाल लिया था और उन्हें मामूली - सी टिकटें खरीदने के लिए तैयार किया था ।,पुलिस के मुताबिक आरोपी रजिस्ट्रार दफ्तर के क्लर्क एवं रिकॉर्डकीपर बलबीर सिंह के साथ मिलकर खाली व पुरानी जमीनों के रिकॉर्ड में से कागजात निकल लेते थे और उसके बाद नए स्टांप पेपर खरीद कर उन पर जाली रजिस्ट्री तैयार कर लेते थे ।
0.034901807086831896,"not only that , but they used to destroy the original registry documents and then the false registry documents were updated in the records .","केवल इतना ही नहीं , लेकिन वे मूल रजिस्ट्री दस्तावेज़ नष्ट करने के लिए इस्तेमाल किया और फिर गलत रजिस्ट्री दस्तावेज़ रिकॉर्ड में अद्यतन किया गया .",यही नहीं उसके बाद असली रजिस्ट्री को गायब कर जाली रजिस्ट्री रिकॉर्ड में चढ़ा देते थे ।
0.050912128230977495,then the accused use to sell the land with counterfeit papers for crores of rupees .,इसके बाद अभियुक्त का उपयोग है कि वह देश की भूमि को कई करोड़ रुपये तक भेजता है ।,इसके बाद आरोपी जाली कागजात पर जमीन को करोड़ों रुपये में बेच देते थे ।
0.0367352656298894,"at the same time , they would take out loans against these counterfeit documents .","एक ही समय में , वे इन विमर्तों के खिलाफ उधार लेंगे .","वहीं , इन जाली कागजात पर लोन ले लेते थे ।"
0.08008590977659769,"thereafter , the original owner would be left running to the police and administration .",इसके बाद मूल मालिक को पुलिस और प्रशासन के लिए प्रस्थान किया जाएगा ।,इसके बाद जमीन का असली मालिक पुलिस व प्रशासन के धक्के खाता रह जाता था ।
0.031251907639724415,those accused of the counterfeit registrations were especially intersted in the nrig plots .,इस प्रकार की कठिनाइयों की वजह से इन लोगों की निन्दा की जाती थी ।,जाली रजिस्ट्री तैयार करवाने वाले आरोपी एनआरआइजी की जमीनों पर खास नजर रखते थे ।
0.040272481924218506,as no - one was looking after the nrig plots .,जैसे - जैसे किसी भी व्यक्ति की हत्या हो रही थी ।,क्योंकि एनआरआइजी की जमीन की देखरेख करने वाला कोई नहीं होता ।
0.03667862829704212,so it was easy to forge registration documents and sell the land .,इसलिए पंजीकरण दस्तावेज़ बनाना आसान था ।,इसलिए उन जमीनों की जाली रजिस्ट्री तैयार कर बेचना आसान रहता है ।
