bleu,x,y,z
0.02820854103817702,"the announcement came as fighting raged thursday in the town of safira , which experts say is home to a chemical weapons production facility as well as storage sites , reported the britain - based syrian observatory for human rights .","इस घोषणा की घोषणा आक्रमणकारी के नगर में हुई , जो एक रासायनिक शस्त्र उत्पादन सुविधा के लिए घर है , जिसमें विशेषज्ञ कहते हैं कि एक रासायनिक शस्त्र उत्पादन सुविधा और भंडारण स्थलों की जानकारी मानव अधिकारों के लिए दी गयी है ।","ब्रिटेन स्थिति सीरियन ऑब्जर्वेटरी फॉर ह्यूमन राइट्स ने रिपोर्ट दी है कि यह घोषणा उस समय हुई जब गुरुवार को सफीरा शहर में संघर्ष में वृद्धि हुई , जिसके बारे में विशेषज्ञों का मानना है कि यह रासायनिक हथियार उत्पादन इकाई के और साथ ही संग्रहण केन्द्र है ।"
0.1532477147515517,"the activist group , which has been tracking the death toll through a network of activists in syria , said thursday that 120 , 296 people have died .","कामगार समूह , जो कि विस्तीन में अधिकारियों के जाल के माध्यम से मृत्यु के शिकार को देख रहा है , ने कहा कि 120 लोगों की मृत्यु हो गयी है ।","सीरिया में आंदोलन के नेटवर्क के माध्यम से मृतकों की संख्या का विवरण रखने वाले आंदोलन समूह ने गुरुवार को कहा कि 120 , 296 लोगों की मृत्यु हो चुकी हैं ।"
0.15687225301340732,"of those , it said 61 , 067 are civilians , including 6 , 365 children .","उन लोगों के लिए , यह 61 , विलिंग्ड़ा , 6 , 365 बच्चे सहित ।","उसने कहा है कि इसमें से 6 , 365 बच्चे समेत 61 , 067 आम नागरिक शामिल हैं ।"
0.12197379410305399,"on the government side , it said 29 , 954 are members of president bashar assad ' s armed forces , 18 , 678 are pro - government fighters and 187 are lebanese hezbollah militants .","सरकार की ओर से , यह 29 , विविविवितराव की सशस्त्र शक्तियों के सदस्य हैं , 18 विविवितियां - - - - - - - - - - - - - - - - - - - - - - - - - - - - - - - - - - - ।","सरकार की ओर से कहा गया है कि 29 , 954 राष्ट्रपति बशर असद की सैन्य सेना के सदस्य हैं , 18 , 678 सरकार के पक्ष में लड़ने वाले लड़ाकू हैं तथा 187 लेबनीज हिजबुल्लाह उग्रवादी हैं ।"
0.10143048622292769,"also among the dead it said were 2 , 202 army defectors and some 5 , 375 opposition fighters , many of them foreigners .","यह भी कहा जा सकता है कि इस मृत में 2 , विस्तीन सेना की चट्टियाँ और 5 , तोड़ विरोधी सैनिकों को विदेशियों का विदेशी था ।","इसने यह भी कहा कि मृतकों में 2 , 202 सेना के भगोड़े तथा लगभग 5 , 375 विपक्षी लड़ाकू हैं , जिसमें से बहुत से विदेशी हैं ।"
0.21396519486017826,"on july 25 , the u . n . estimated 100 , 000 have died in the conflict since march 2011 .","25 , 000 वर्ष की दूरी पर , मार्च 2011 से संघर्ष में लगभग 100 , 000 की मृत्यु हुई है ।","25 जुलाई को यू . एन . ने अनुमान व्यक्त किया कि मार्च 2011 से चले आ रहे संघर्ष में लगभग 100 , 000 लोगों की मृत्यु हो चुकी है ।"
0.06274655310994741,it has not updated that figure since .,यह कि से बाहर आंकड़ा अद्यतन नहीं है ।,इसने तब से आंकड़ों को अपडेट नहीं किया ।
0.060196087687056546,the conflict has forced some 2 million people to flee the country .,संघर्ष ने कुछ लाख लोगों को देश में भाग जाने के लिए मजबूर कर दिया है ।,इस संघर्ष के कारण लगभग 20 लाख लोग देश छोड़ने के लिए मज़बूर हुए हैं ।
0.020752738657056447,"assad ' s troops have been battling rebels , many of them linked to al - qaida groups , in safira for weeks .","कैम्पबेल की सेनाओं को खंडित कर दिया गया है , उनमें से अनेक लोग एक - दूसरे के साथ एक - दूसरे के साथ जुड़ गये ।","असद का सैन्य दल सफीरा में कई सप्ताह तक विद्रोहियों से युद्ध करता रहा , जिनमें से कई लोग अल - कायदा समूहों से सम्बन्धित थे ।"
0.1385305169184856,the observatory said there were casualties on both sides thursday but had no specifics .,"स्लाइफ़िया ने कहा कि दोनों पक्षों पर छल - कपट किया गया है , लेकिन इसमें कोई विकथित नहीं है ।","गुरुवार को ऑब्जर्वेटरी ने कहा कि दोनों ओर से लोग हताहत हुए हैं , लेकिन स्पष्ट रूप से कुछ नहीं कहा ।"
0.02658290323419595,the fighting underscored the dangers the chemical weapons ' inspectors face as they race against tight deadlines in their mission to rid syria of the toxic arsenal in the midst of an ongoing civil war .,लड़ाई में रासायनिक अस्त्र - शस्त्रों की निंदा करने के लिए अपने मिशन में कठोर स्लेजों की बौछार करने के लिए संघर्ष करने के लिए उन्होंने अपने मिशन के खतरों को खत्म कर दिया है ।,"यह युद्ध , रासायनिक हथियारों के निरीक्षकों द्वारा सामना किए जाने वाले खतरे को दर्शाता है , जिनके पास बहुत कम समय - सीमा में , चल रहे गृह युद्ध के दौरान सीरिया में विषाक्त हथियार समाप्त करने का मिशन है ।"
0.08774822984278771,"a statement from the opcw , which works closely with the united nations , said its team was "" now satisfied that it has verified - and seen destroyed - all of syria ' s declared critical production and mixing / filling equipment . ""","एक विवरण , जो संयुक्त देशों से घनिष्ठ रूप से काम करता है , ने कहा है कि इसके टीम ने इस बात की पुष्टि की है कि इसे सत्यापित किया है और उसे नष्ट कर दिया है - सभी टेप की घोषित आलोचनात्मक उत्पादन और मिश्रण / भरने के उपकरण ।","संयुक्त राष्ट्र के साथ मिलकर काम करने वाले ओ . पी . सी . डब्लू . की ओर बयान में कहा गया कि इसका दल "" अभी संतुष्ट है तथा इसने पुष्टि कर ली है - तथा सीरिया के सभी घोषित महत्वपूर्ण उत्पादन और मिश्रण / भरने वाले उपकरणों को - नष्ट रूप में देख लिया है । """
0.07237067599340367,"it added that , "" no further inspection activities are currently planned . ""","यह शामिल है , "" कोई और निरीक्षण गतिविधि वर्तमान में योजना है . ""","इसने यह भी कहा , "" आगे कोई निरीक्षण गतिविधि की योजना नहीं बनाई जा रही । """
0.19867176085883512,"earlier this week , the inspectors said they had completed their first round of verification work , visiting 21 of 23 sites declared by damascus .","इस सप्ताह के पहले , आक्रमणकारी ने कहा था कि उन्होंने अपने पहले में सत्यापन कार्य के प्रथम दौर को पूरा कर लिया है , जिसे विविविविठित द्वारा घोषित किया गया था ।",इस सप्ताह के आरंभ में निरीक्षकों ने कहा था कि उन्होंने डमस्कस द्वारा घोषित 23 केन्द्रों में से 21 केन्द्रों पर जाकर पुष्टि कार्य का प्रथम चरण पूर्ण कर लिया है ।
0.07456500977172462,"they were unable to visit two sites because of security concerns , the inspectors said .",वे सुरक्षा की चिंताओं के कारण दो स्थानों से मिलने में असमर्थ थे ।,निरीक्षकों ने कहा कि वे सुरक्षा कारणों से दो केन्द्रों पर जाने में सक्षम नहीं थे ।
0.020960847347926113,"on thursday , opcw said the two locations were , according to syria , "" abandoned and . . . the chemical weapons program items they contained were moved to other declared sites , which were inspected . ""","विस्तीन पर , आक्रमणकारी ने कहा था कि दो स्थानों के लिए दो स्थानों का प्रयोग किया गया है ।","शुक्रवार को ओ . पी . सी . डब्लू . ने कहा कि सीरिया के अनुसार ये दो केन्द्र "" त्याग दिए गए हैं तथा . . . वहां रखी गई रासायनिक हथियार उत्पाद वस्तुओं को अन्य घोषित केन्द्रों पर पहुंचा दिया गया था , जिसका निरीक्षण कर लिया गया है । """
0.05522765087566719,it was not immediately clear if the facility in safira was one of the two sites that opcw inspectors were not able to visit .,"यह निश्चित रूप से स्पष्ट नहीं था कि विस्तीन में जो सुविधाएं है , उनमें से एक है - - - - - - - - - - - - - ।","यह तत्काल स्पष्ट नहीं हुआ कि सफीरा में इकाई , उन दो केन्द्रों में से एक है या नहीं , जहां ओ . पी . सी . डब्लू . के निरीक्षक जाने में सक्षम नहीं थे ।"
0.3184775545072929,syria has submitted a plan for the total destruction of its chemical weapons that has to be approved next month by the opcw ' s executive committee .,"कैम्पबेल ने अपने रासायनिक हथियारों के विनाश के लिए एक योजना प्रस्तुत की है , जिसका अगले महीने विलिंग्गी कार्यकारिणी समिति द्वारा अनुमोदित किया जाना है ।","सीरिया ने अपने रासायनिक हथियारों के सम्पूर्ण विनाश के लिए योजना प्रस्तुत की है , जिसे अगले महीने ओ . पी . सी . डब्लू . की कार्यकारी समिति द्वारा स्वीकृत किया जाना है ।"
0.12498217089694703,""" i salute the fortitude and courage you ' ve all demonstrated in fulfilling the most challenging mission ever undertaken by this organization , "" the watchdog ' s director - general , ahmet uzumcu , said in comments released by the opcw .","' ' मैं इस संगठन द्वारा कभी भी किए गए सबसे चुनौतीपूर्ण मिशन को पूरा करने में अपने धैर्य और साहस को सलाम करता हूं , जो इस संगठन द्वारा किया गया सबसे चुनौतीपूर्ण मिशन है ।","ओ . पी . सी . डब्लू . द्वारा जारी टिप्पणी में निगरानी करने वाले समूह के महानिदेशक अहमट उजुम्कु ने कहा , "" इस संगठन द्वारा अब तक किए गए सबसे चुनौतीपूर्ण मिशन को पूर्ण करने में आप लोगों द्वारा प्रदर्शित की गई दृढ़ता तथा हौसले को मैं सलाम करता हूँ । """
0.03219425957071092,"now in its third year , the civil war pits the primarily sunni muslim rebels against assad ' s government and its security forces , which are stacked with members of his alawite sect , an offshoot of shiite islam .","अब अपने तीसरे वर्ष में सिविल युद्ध के गड्ढे का मुख्य रूप से टूट जाने वाली सरकार और उसकी सुरक्षा शक्तियों के विरुद्ध राजद्रोह की सरकार और उसकी सुरक्षा शक्तियों के विरुद्ध है , जो उनके भ्रष्ट संप्रदाय के सदस्यों के साथ हैं ।","तीन वर्षों से चला आ रहा यह गृह युद्ध मुख्यः रूप से असद की सरकार तथा उसके सुरक्षा बलों , जिसमें शिया इस्लाम के से निकले , अलावाइट पंथ के सदस्य शामिल हैं , तथा विद्रोही सुन्नी मुस्लिमों के बीच का संघर्ष है ।"
0.11133839063603111,"in other developments , the observatory ' s chief rami abdurrahman said there had been a strong explosion wednesday inside an air defense facility in syria ' s coastal province of latakia .",अन्य घटनाओं में कैम्पबेल के प्रधान फकीर ने कहा था कि तपन के तटीय क्षेत्र में एक वायुव्यापी विस्फोट का एक जोरदार विस्फोट हुआ है ।,अन्य घटनाक्रम में आब्जर्वेटरी के प्रमुख रामी अब्दुर्रहमान ने कहा कि सीरिया के तटीय क्षेत्र लताकिया में एयर डिफेन्स केन्द्र में बुधवार को जोरदार विस्फोट हुआ था ।
0.013374921665437396,"the cause of the blast was not known , he said .",उसने कहा ।,उन्होंने कहा कि इस विस्फोट का कारण अभी ज्ञात नहीं है ।
0.04507975895726357,"police seized a forged registry , forged seals , a laptop and photocopies of registration documents from the accused .","पुलिस ने एक जाली कोषाकार , संचित मुहर , अभियुक्त द्वारा पंजीकरण दस्तावेजों का एक विघन और विमोचन किया ।","पुलिस ने आरोपियों के कब्जे से जाली रजिस्ट्री , जाली मुहरें , लैपटॉप और जाली रजिस्ट्री की फोटो कॉपियां बरामद की हैं ।"
0.1458377646085636,moti nagar police have registered a case against the accused .,बर्खास्त नगर पुलिस ने अभियुक्तों के विरुद्ध मुकदमा दायर किया है ।,मोती नगर पुलिस ने सभी आरोपियों पर मामला दर्ज कर लिया है ।
0.013644571010496757,"police commissioner paramjit singh said that those arrested and accused are haiboval rajiv agarwal a . k . a . bintu from chandan nagar , from ghumar mandi , kamal krushna jaiswal , gurwinder singh jaggi from kohada and sonu from ghumar mandi .","पुलिस - विवाहित सिंह ने कहा कि जिन लोगों ने गिरफ्तार और अभियुक्त को गिरफ्तार कर लिया है , उनका अपहरण कर दिया गया है ।","पुलिस कमिश्नर परमजीत सिंह गिल ने बताया कि गिरफ्तार आरोपियों में हैबोवल स्थित चंद्र नगर का राजीव अग्रवाल उर्फ बिंट्टू , घुमार मंडी का कमल कृष्ण जसवाल , कोहाड़ा का गुरिंदर सिंह गग्गी और घुमार मंडी का सोनू शामिल हैं ।"
0.06959578721753987,balbir singh from the registrar office ( east ) has fled from the scene .,हमलावर कार्यालय ( पूर्व पूर्व ) से वितप्त सिंह भी भाग रहा है ।,रजिस्ट्रार दफ्तर ( पूर्वी ) का बलबीर सिंह मौके से फरार हो गया है ।
0.03428486711379147,"according to the police the accused used to take out the documents of the records of vacant and old plots with the help of balbir singh , a clerk and record keeper in the registrar office and then , by purchasing new stamp papers , used to make counterfeit registration documents for them .",पुलिस के अनुसार अभियुक्त खाली और पुराने भूखंडों के रिकार्टों की मदद से खाली और पुराने भूखंडों के रिकार्टों की मदद से निकले थे और फिर नये टिकट कागज खरीदने के लिए नये टिकट - कागज़ों की खरीद करते थे ।,पुलिस के मुताबिक आरोपी रजिस्ट्रार दफ्तर के क्लर्क एवं रिकॉर्डकीपर बलबीर सिंह के साथ मिलकर खाली व पुरानी जमीनों के रिकॉर्ड में से कागजात निकल लेते थे और उसके बाद नए स्टांप पेपर खरीद कर उन पर जाली रजिस्ट्री तैयार कर लेते थे ।
0.03176023542809473,"not only that , but they used to destroy the original registry documents and then the false registry documents were updated in the records .","न केवल यही , बल्कि वे मूल वितारकारी दस्तावेजों को नष्ट करने के लिए प्रयोग करते थे और उस समय झूठे स्कैकलैंट दस्तावेज अद्यतन किए गए थे ।",यही नहीं उसके बाद असली रजिस्ट्री को गायब कर जाली रजिस्ट्री रिकॉर्ड में चढ़ा देते थे ।
0.04553719184146072,then the accused use to sell the land with counterfeit papers for crores of rupees .,इसके बाद अभियुक्त को रूपये - पैसे के लिए वितारित पेपर के साथ बेचने का उपयोग किया जाता है ।,इसके बाद आरोपी जाली कागजात पर जमीन को करोड़ों रुपये में बेच देते थे ।
0.04065425428798724,"at the same time , they would take out loans against these counterfeit documents .",इसके साथ ही वे इन विविविबरकारी दस्तावेजों के विरुद्ध ऋण लेते हैं ।,"वहीं , इन जाली कागजात पर लोन ले लेते थे ।"
0.08736015370428478,"thereafter , the original owner would be left running to the police and administration .",इसके बाद मूल मालिक पुलिस और प्रशासन के लिए चल पड़े ।,इसके बाद जमीन का असली मालिक पुलिस व प्रशासन के धक्के खाता रह जाता था ।
0.026279617104084448,those accused of the counterfeit registrations were especially intersted in the nrig plots .,निंदा के उन अभियुक्तों ने विशेष रूप से विस्तीन के क्षेत्र में विघ्त किया ।,जाली रजिस्ट्री तैयार करवाने वाले आरोपी एनआरआइजी की जमीनों पर खास नजर रखते थे ।
0.045037337510569944,as no - one was looking after the nrig plots .,जैसे - जैसे किसी भी व्यक्ति की तलाश नहीं थी ।,क्योंकि एनआरआइजी की जमीन की देखरेख करने वाला कोई नहीं होता ।
0.04065425428798724,so it was easy to forge registration documents and sell the land .,इसलिए पंजीकरण दस्तावेज बनाना और भूमि को बेचने के लिए आसान था ।,इसलिए उन जमीनों की जाली रजिस्ट्री तैयार कर बेचना आसान रहता है ।
